hanzi_simplified,hanzi_traditional,pinyin,english_meanings,hsk_levels,pos,frequency_rank,character_count,length_bucket,example_zh,example_en
走后门,走後門,zǒu hòu mén,lit. to enter by the back door; fig. to gain influence by pull or unofficial channels; back door or under the counter connections,new-7,v,33149,3,3-char,我每天都走后门。,I lit. to enter by the back door every day.
防盗门,防盜門,fáng dào mén,security door,new-7,n,33898,3,3-char,这是防盗门。,This is a security door.
闭幕式,閉幕式,bì mù shì,closing ceremony,"newest-5, new-5",n,34114,3,3-char,这是闭幕式。,This is a closing ceremony.
洗涤剂,洗滌劑,xǐ dí jì,cleaning agent; detergent,new-7,n,34376,3,3-char,这是洗涤剂。,This is a cleaning agent.
不敢当,不敢當,bù gǎn dāng,lit. I dare not (accept the honor); fig. I don't deserve your praise; you flatter me,"newest-7, new-5, old-6",v,35004,3,3-char,我每天都不敢当。,I lit. I dare not ; fig. I don't deserve your praise every day.
东道主,東道主,dōng dào zhǔ,host; official host (e.g. venue for games or a conference),"newest-7, new-7, old-6",n,35077,3,3-char,这是东道主。,This is a host.
螺丝钉,螺絲釘,luó sī dīng,screw,old-6,n,35456,3,3-char,这是螺丝钉。,This is a screw.
走过场,走過場,zǒu guò chǎng,to go through the motions,"newest-7, new-7",v,35620,3,3-char,我每天都走过场。,I to go through the motions every day.
阅览室,閱覽室,yuè lǎn shì,reading room,new-5,n,35678,3,3-char,这是阅览室。,This is a reading room.
立方米,立方米,lì fāng mǐ,cubic meter (unit of volume),"newest-7, new-7",q,35946,3,3-char,我在学习“立方米”。,I'm learning '立方米'.
公开信,公開信,gōng kāi xìn,open letter,new-7,n,35990,3,3-char,这是公开信。,This is an open letter.
说不上,說不上,shuō bu shàng,to be unable to say or tell; to not be worth mentioning,"newest-7, new-7",v,36064,3,3-char,我每天都说不上。,I to be unable to say or tell every day.
带头人,帶頭人,dài tóu rén,leader,new-7,n,36083,3,3-char,这是带头人。,This is a leader.
跑龙套,跑龍套,pǎo lóng tào,to play a small role,"newest-7, new-7",v,36523,3,3-char,我每天都跑龙套。,I to play a small role every day.
喜洋洋,喜洋洋,xǐ yáng yáng,radiant with joy,"newest-7, new-7",,36979,3,3-char,我在学习“喜洋洋”。,I'm learning '喜洋洋'.
羽绒服,羽絨服,yǔ róng fú,down-filled garment,"newest-6, new-5, old-6",n,37036,3,3-char,这是羽绒服。,This is a down-filled garment.
豆制品,豆製品,dòu zhì pǐn,legume-based product; soybean product,new-5,n,37535,3,3-char,这是豆制品。,This is a legume-based product.
沉甸甸,沉甸甸,chén diàn diàn,heavy,"newest-7, new-7",z,37849,3,3-char,我在学习“沉甸甸”。,I'm learning '沉甸甸'.
半边天,半邊天,bàn biān tiān,half the sky; women of the new society; womenfolk,"newest-7, new-7",n,37858,3,3-char,这是半边天。,This is a half the sky.
农民工,農民工,nóng mín gōng,migrant worker (who moved from a rural area of China to a city to find work),"newest-7, new-7",n,38309,3,3-char,这是农民工。,This is a migrant worker.
泼冷水,潑冷水,pō lěng shuǐ,to pour cold water on; (fig.) to dampen sb's enthusiasm,"newest-7, new-7",v,38596,3,3-char,我每天都泼冷水。,I to pour cold water on every day.
定心丸,定心丸,dìng xīn wán,tranquilizer; sth that sets one's mind at ease,"newest-7, new-7",n,38626,3,3-char,这是定心丸。,This is a tranquilizer.
不亚于,不亞於,bù yà yú,no less than; not inferior to,"newest-7, new-7",v,38742,3,3-char,我每天都不亚于。,I no less than every day.
写字台,寫字檯,xiě zì tái,writing desk,new-6,n,39106,3,3-char,这是写字台。,This is a writing desk.
错别字,錯別字,cuò bié zì,incorrectly written or mispronounced characters,"newest-7, new-7",n,39226,3,3-char,这是错别字。,This is an incorrectly written or mispronounced characters.
繁体字,繁體字,fán tǐ zì,traditional Chinese character,"newest-7, new-7, old-6",,39543,3,3-char,我在学习“繁体字”。,I'm learning '繁体字'.
譬如说,譬如說,pì rú shuō,for example,new-7,v,40154,3,3-char,我每天都譬如说。,I for example every day.
没法儿,沒法兒,méifǎr5,Can't,"newest-5, new-4",l,41071,3,3-char,我在学习“没法儿”。,I'm learning '没法儿'.
无形中,無形中,wú xíng zhōng,imperceptibly; virtually,new-7,d,41160,3,3-char,他无形中来。,He comes imperceptibly.
钻空子,鑽空子,zuān kòng zi,to take advantage of a loophole; to exploit an advantage; to seize the opportunity (esp. to do sth bad),"newest-7, new-7",v,41378,3,3-char,我每天都钻空子。,I to take advantage of a loophole; to exploit an advantage; to seize the opportunity every day.
纯净水,純淨水,chún jìng shuǐ,purified water,new-4,n,41403,3,3-char,这是纯净水。,This is a purified water.
说闲话,說閒話,shuō xián huà,to chat; to gossip,new-7,v,41546,3,3-char,我每天都说闲话。,I to chat every day.
干活儿,幹活兒,gàn huó r,erhua variant of 干活; (coll.) to work; (coll.) to be employed,"newest-4, new-2, old-5",v,41800,3,3-char,我每天都干活儿。,I erhua variant of 干活 every day.
私房钱,私房錢,sī fáng qián,secret purse; secret stash of money,new-7,n,42411,3,3-char,这是私房钱。,This is a secret purse.
看得起,看得起,kàn de qǐ,to show respect for; to think highly of,"newest-6, new-6",v,42625,3,3-char,我每天都看得起。,I to show respect for every day.
捉迷藏,捉迷藏,zhuō mí cáng,to play hide-and-seek,"newest-7, new-7",,43140,3,3-char,我在学习“捉迷藏”。,I'm learning '捉迷藏'.
一锅粥,一鍋粥,yī guō zhōu,(lit.) a pot of porridge; (fig.) a complete mess,new-7,l,43564,3,3-char,我在学习“一锅粥”。,I'm learning '一锅粥'.
马后炮,馬後炮,mǎ hòu pào,lit. firing after the horse; fig. belated action; giving advice in hindsight,"newest-7, new-7",v,44420,3,3-char,我每天都马后炮。,I lit. firing after the horse every day.
爱面子,愛面子,ài miàn zi,to like to look good in the eyes of others; sensitive about how one is regarded by others; proud,new-7,a,44438,3,3-char,这个很爱面子。,This is very to like to look good in the eyes of others; sensitive about how one is regarded by others; proud.
中秋节,中秋節,Zhōng qiū jié,the Mid-Autumn Festival on 15th of 8th lunar month,new-5,t,44601,3,3-char,我们中秋节见。,See you the Mid-Autumn Festival on 15th of 8th lunar month.
平常心,平常心,píng cháng xīn,levelheadedness; calmness; equanimity,new-7,n,45789,3,3-char,这是平常心。,This is a levelheadedness.
走弯路,走彎路,zǒu wān lù,to take an indirect route; to waste one's time by using an inappropriate method,"newest-7, new-7",v,46527,3,3-char,我每天都走弯路。,I to take an indirect route every day.
电子版,電子版,diàn zǐ bǎn,electronic edition; digital version,"newest-5, new-5",n,48366,3,3-char,这是电子版。,This is an electronic edition.
海内外,海內外,hǎi nèi wài,domestic and international; at home and abroad,"newest-6, new-7",s,48536,3,3-char,这是海内外。,This is a domestic and international.
四合院,四合院,sì hé yuàn,courtyard house with a fully enclosed courtyard (type of Chinese residence),new-7,n,48844,3,3-char,这是四合院。,This is a courtyard house with a fully enclosed courtyard.
开夜车,開夜車,kāi yè chē,to burn the midnight oil; to work late into the night,new-6,v,49510,3,3-char,我每天都开夜车。,I to burn the midnight oil every day.
出洋相,出洋相,chū yáng xiàng,to make a fool of oneself,"new-7, old-6",v,50871,3,3-char,我每天都出洋相。,I to make a fool of oneself every day.
非金属,非金屬,fēi jīn shǔ,nonmetal (chemistry),new-7,n,53625,3,3-char,这是非金属。,This is a nonmetal.
没说的,沒說的,méi shuō de,nothing to pick on; really good; nothing to discuss; settled matter; no problem,new-7,v,54259,3,3-char,我每天都没说的。,I nothing to pick on every day.
美滋滋,美滋滋,měi zī zī,very happy; elated,"newest-7, new-7",z,54509,3,3-char,我在学习“美滋滋”。,I'm learning '美滋滋'.
没准儿,沒準兒,méi zhǔn r,erhua variant of 没准; not sure; maybe,"newest-7, new-7",,55268,3,3-char,我在学习“没准儿”。,I'm learning '没准儿'.
心眼儿,心眼兒,xīn yǎn r,one's thoughts; mind; intention; willingness to accept new ideas; baseless suspicions,"newest-7, new-7, old-6",,55439,3,3-char,我在学习“心眼儿”。,I'm learning '心眼儿'.
端午节,端午節,Duān wǔ jié,Dragon Boat Festival (5th day of the 5th lunar month),"new-6, old-6",t,56867,3,3-char,我们端午节见。,See you Dragon Boat Festival.
印刷术,印刷術,yìn shuā shù,printing; printing technology,new-7,n,56927,3,3-char,这是印刷术。,This is a printing.
水灵灵,水靈靈,shuǐ líng líng,see 水灵,new-7,z,57146,3,3-char,我在学习“水灵灵”。,I'm learning '水灵灵'.
简体字,簡體字,jiǎn tǐ zì,"simplified Chinese character, as opposed to traditional Chinese character 繁体字","newest-7, new-7, old-6",,57431,3,3-char,我在学习“简体字”。,I'm learning '简体字'.
老伴儿,老伴兒,lǎo bàn r,erhua variant of 老伴; (coll.) (of an old couple) husband or wife,"newest-7, new-7",n,60338,3,3-char,这是老伴儿。,This is an erhua variant of 老伴.
红扑扑,紅撲撲,hóng pū pū,red; rosy; flushed,"newest-7, new-7",z,61564,3,3-char,我在学习“红扑扑”。,I'm learning '红扑扑'.
糖葫芦,糖葫蘆,táng hú lu,sugar-coated Chinese hawthorn or other fruit on a bamboo skewer; tanghulu,old-6,n,62842,3,3-char,这是糖葫芦。,This is a sugar-coated Chinese hawthorn or other fruit on a bamboo skewer.
冰棍儿,冰棍兒,bīng gùn r,ice lolly; popsicle,"newest-7, new-7",n,62971,3,3-char,这是冰棍儿。,This is an ice lolly.
碰钉子,碰釘子,pèng dīng zi,to meet with a rebuff,"newest-7, new-7",v,65600,3,3-char,我每天都碰钉子。,I to meet with a rebuff every day.
暖烘烘,暖烘烘,nuǎn hōng hōng,nice and warm; cozy; heartwarming,"newest-7, new-7",z,68189,3,3-char,我在学习“暖烘烘”。,I'm learning '暖烘烘'.
重阳节,重陽節,Chóng yáng jié,Double Ninth or Yang Festival; 9th day of 9th lunar month,old-6,t,71111,3,3-char,我们重阳节见。,See you Double Ninth or Yang Festival.
穿小鞋,穿小鞋,chuān xiǎo xié,lit. to make sb wear tight shoes (idiom); to make life difficult for sb,new-7,v,71586,3,3-char,我每天都穿小鞋。,I lit. to make sb wear tight shoes every day.
纳闷儿,納悶兒,nà mèn r,erhua variant of 纳闷; puzzled; bewildered,"newest-7, new-7, old-6",,77711,3,3-char,我在学习“纳闷儿”。,I'm learning '纳闷儿'.
侃大山,侃大山,kǎn dà shān,to chatter idly; to gossip; to boast or brag,new-7,,82206,3,3-char,我在学习“侃大山”。,I'm learning '侃大山'.
爆冷门,爆冷門,bào lěng mén,an upset (esp. in sports); unexpected turn of events; to pull off a coup; a breakthrough,new-7,v,84475,3,3-char,我每天都爆冷门。,I an upset every day.
个头儿,個頭兒,gè tóu r,size; height; stature,"newest-7, new-7",,87095,3,3-char,我在学习“个头儿”。,I'm learning '个头儿'.
电饭锅,電飯鍋,diàn fàn guō,electric rice cooker,"newest-6, new-5",n,88712,3,3-char,这是电饭锅。,This is an electric rice cooker.
造纸术,造紙術,zào zhǐ shù,papermaking process,new-7,,93172,3,3-char,我在学习“造纸术”。,I'm learning '造纸术'.
聊天儿,聊天兒,liáo tiān r,erhua variant of 聊天; to chat; to gossip,"newest-3, new-6",,102289,3,3-char,我在学习“聊天儿”。,I'm learning '聊天儿'.
敲边鼓,敲邊鼓,qiāo biān gǔ,to back sb up; to support sb in an argument; (lit. to beat nearby drum),new-7,v,102372,3,3-char,我每天都敲边鼓。,I to back sb up every day.
小偷儿,小偷兒,xiǎotōur5,Thief,"newest-6, new-5",,147151,3,3-char,我在学习“小偷儿”。,I'm learning '小偷儿'.
胡同儿,胡同兒,hútòngr5,Alley,new-5,,165503,3,3-char,我在学习“胡同儿”。,I'm learning '胡同儿'.
随大溜,隨大溜,suí dà liù,to follow the crowd; going with the tide,new-7,,182989,3,3-char,我在学习“随大溜”。,I'm learning '随大溜'.
一下儿,一下兒,yī xià r,erhua variant of 一下; one time; once; all of sudden,new-1,,1000000,3,3-char,我在学习“一下儿”。,I'm learning '一下儿'.
一卡通,一卡通,Yī kǎ tōng,"the name of various contactless smart cards, notably Yikatong (mainly for public transport in Beijing) and iPASS (mainly for public transport in Taiwan)",new-7,,1000000,3,3-char,我在学习“一卡通”。,I'm learning '一卡通'.
下个月,下個月,xià gè yuè,next month,new-4,,1000000,3,3-char,我在学习“下个月”。,I'm learning '下个月'.
不服气,不服氣,bù fú qì,unwilling to concede; defiant; indignant; to find it galling,new-7,,1000000,3,3-char,我在学习“不服气”。,I'm learning '不服气'.
二维码,二維碼,èr wéi mǎ,two-dimensional barcode; QR code,"newest-5, new-5",,1000000,3,3-char,我在学习“二维码”。,I'm learning '二维码'.
人缘儿,人緣兒,rén yuán r,erhua variant of 人缘; relations with other people,"newest-7, new-7",,1000000,3,3-char,我在学习“人缘儿”。,I'm learning '人缘儿'.
使劲儿,使勁兒,shǐ jìn r,erhua variant of 使劲; to exert all one's strength,old-5,,1000000,3,3-char,我在学习“使劲儿”。,I'm learning '使劲儿'.
便利店,便利店,biàn lì diàn,convenience store,"newest-5, new-7",,1000000,3,3-char,我在学习“便利店”。,I'm learning '便利店'.
公交车,公交車,gōng jiāo chē,public transport vehicle; town bus,"newest-2, new-2",,1000000,3,3-char,我在学习“公交车”。,I'm learning '公交车'.
别提了,別提了,bié tí le,say no more; don't bring it up; drop the subject,new-7,,1000000,3,3-char,我在学习“别提了”。,I'm learning '别提了'.
办不到,辦不到,bàn bu dào,impossible; can't be done; no can do; unable to accomplish,new-7,,1000000,3,3-char,我在学习“办不到”。,I'm learning '办不到'.
取款机,取款機,qǔ kuǎn jī,ATM,new-6,,1000000,3,3-char,我在学习“取款机”。,I'm learning '取款机'.
吃不上,吃不上,chī bu shàng,unable to get anything to eat; to miss a meal,new-7,,1000000,3,3-char,我在学习“吃不上”。,I'm learning '吃不上'.
名牌儿,名牌兒,míngpáir5,Famous brand,new-4,,1000000,3,3-char,我在学习“名牌儿”。,I'm learning '名牌儿'.
后备箱,後備箱,hòu bèi xiāng,trunk; boot (of a car),"newest-7, new-7",,1000000,3,3-char,我在学习“后备箱”。,I'm learning '后备箱'.
哪知道,哪知道,nǎ zhī dào,who would have thought that ...?,new-7,,1000000,3,3-char,我在学习“哪知道”。,I'm learning '哪知道'.
墨水儿,墨水兒,mò shuǐ r,erhua variant of 墨水; ink,old-6,,1000000,3,3-char,我在学习“墨水儿”。,I'm learning '墨水儿'.
大数据,大數據,dà shù jù,big data (computing),"newest-7, new-7",,1000000,3,3-char,我在学习“大数据”。,I'm learning '大数据'.
大腕儿,大腕兒,dà wàn r,erhua variant of 大腕; (coll.) big name; (coll.) big shot,new-7,,1000000,3,3-char,我在学习“大腕儿”。,I'm learning '大腕儿'.
如果说,如果說,rú guǒ shuō,if; if one were to say,new-7,,1000000,3,3-char,我在学习“如果说”。,I'm learning '如果说'.
快点儿,快點兒,kuài diǎn r,erhua variant of 快点; to do smh more quickly; Hurry up!,new-2,,1000000,3,3-char,我在学习“快点儿”。,I'm learning '快点儿'.
性价比,性價比,xìng jià bǐ,cost-performance ratio,"newest-6, new-7",,1000000,3,3-char,我在学习“性价比”。,I'm learning '性价比'.
打盹儿,打盹兒,dǎ dǔn r,erhua variant of 打盹; to doze off,"newest-7, new-7",,1000000,3,3-char,我在学习“打盹儿”。,I'm learning '打盹儿'.
打篮球,打籃球,dǎ lán qiú,to play basketball,old-2,,1000000,3,3-char,我在学习“打篮球”。,I'm learning '打篮球'.
招投标,招投標,zhāo tóu biāo,bid inviting and bid offering; bidding; auction,old-6,,1000000,3,3-char,我在学习“招投标”。,I'm learning '招投标'.
放暑假,放暑假,fàng shǔ jià,to be on summer vacation,old-4,,1000000,3,3-char,我在学习“放暑假”。,I'm learning '放暑假'.
有一些,有一些,yǒu yī xiē,somewhat; rather; some,new-1,,1000000,3,3-char,我在学习“有一些”。,I'm learning '有一些'.
有劲儿,有勁兒,yǒujìnr5,Strength,new-4,,1000000,3,3-char,我在学习“有劲儿”。,I'm learning '有劲儿'.
有没有,有沒有,yǒu méi yǒu,"(before a noun) Do (you, they etc) have ...?; Is there a ...?; (before a verb) Did (you, they etc) (verb, infinitive)?; Have (you, they etc) (verb, past participle)?",new-6,,1000000,3,3-char,我在学习“有没有”。,I'm learning '有没有'.
有空儿,有空兒,yǒukòngr5,available,new-2,,1000000,3,3-char,我在学习“有空儿”。,I'm learning '有空儿'.
极少数,極少數,jí shǎo shù,extremely few; a small minority,new-7,,1000000,3,3-char,我在学习“极少数”。,I'm learning '极少数'.
正能量,正能量,zhèng néng liàng,positive energy; positivity,"newest-7, new-7",,1000000,3,3-char,我在学习“正能量”。,I'm learning '正能量'.
沐浴露,沐浴露,mù yù lù,shower gel,new-7,,1000000,3,3-char,我在学习“沐浴露”。,I'm learning '沐浴露'.
没想到,沒想到,méi xiǎng dào,didn't expect,new-4,,1000000,3,3-char,我在学习“没想到”。,I'm learning '没想到'.
点击率,點擊率,diǎn jī lǜ,click-through rate (CTR) (Internet),new-7,,1000000,3,3-char,我在学习“点击率”。,I'm learning '点击率'.
男孩儿,男孩兒,nán hái r,erhua variant of 男孩; boy,"newest-2, new-1",,1000000,3,3-char,我在学习“男孩儿”。,I'm learning '男孩儿'.
着眼于,著眼於,zhuóyǎn yú,Focus on,new-7,,1000000,3,3-char,我在学习“着眼于”。,I'm learning '着眼于'.
离谱儿,離譜兒,lí pǔr5,Scientific,"newest-7, new-7",,1000000,3,3-char,我在学习“离谱儿”。,I'm learning '离谱儿'.
私家车,私家車,sī jiā chē,private car,"newest-7, new-7",,1000000,3,3-char,我在学习“私家车”。,I'm learning '私家车'.
笑话儿,笑話兒,xiàohuar5,Joke,new-2,,1000000,3,3-char,我在学习“笑话儿”。,I'm learning '笑话儿'.
系领带,繫領帶,xì lǐng dài,to wear a tie,old-5,,1000000,3,3-char,我在学习“系领带”。,I'm learning '系领带'.
纽扣儿,紐扣兒,niǔ kòu er,button; erhua variant of 纽扣,old-6,,1000000,3,3-char,我在学习“纽扣儿”。,I'm learning '纽扣儿'.
茶馆儿,茶館兒,chá guǎn r,a teashop,new-7,,1000000,3,3-char,我在学习“茶馆儿”。,I'm learning '茶馆儿'.
表面上,表面上,biǎo miàn shang,outwardly; superficially; on the face of it,new-6,,1000000,3,3-char,我在学习“表面上”。,I'm learning '表面上'.
说真的,說真的,shuō zhēn de,to tell the truth; honestly; in fact,new-7,,1000000,3,3-char,我在学习“说真的”。,I'm learning '说真的'.
说起来,說起來,shuō qǐlái,Say,new-7,,1000000,3,3-char,我在学习“说起来”。,I'm learning '说起来'.
谁知道,誰知道,shéi zhī dào,God knows...; Who would have imagined...?,new-7,,1000000,3,3-char,我在学习“谁知道”。,I'm learning '谁知道'.
贪玩儿,貪玩兒,tān wánr5,Greedy,new-7,,1000000,3,3-char,我在学习“贪玩儿”。,I'm learning '贪玩儿'.
软实力,軟實力,ruǎn shí lì,soft power (in international relations),"newest-7, new-7",,1000000,3,3-char,我在学习“软实力”。,I'm learning '软实力'.
那时候,那時候,nà shí hou,at that time,new-2,,1000000,3,3-char,我在学习“那时候”。,I'm learning '那时候'.
银行卡,銀行卡,yín háng kǎ,bank card; ATM card,"newest-3, new-2",,1000000,3,3-char,我在学习“银行卡”。,I'm learning '银行卡'.
面条儿,麵條兒,miàn tiáo r,erhua variant of 面条; noodles,"newest-1, new-1",,1000000,3,3-char,我在学习“面条儿”。,I'm learning '面条儿'.
顾不上,顧不上,gù bu shàng,cannot attend to or manage,new-7,,1000000,3,3-char,我在学习“顾不上”。,I'm learning '顾不上'.
