hanzi_simplified,hanzi_traditional,pinyin,english_meanings,hsk_levels,pos,frequency_rank,character_count,length_bucket,example_zh,example_en
禁不住,禁不住,jīn bu zhù,can't help it; can't bear it,"newest-7, new-7",v,16061,3,3-char,我每天都禁不住。,I can't help it every day.
出发点,出發點,chū fā diǎn,starting point; (fig.) basis; motive,"newest-7, new-7",n,16115,3,3-char,这是出发点。,This is a starting point.
平方米,平方米,píng fāng mǐ,square meter,"newest-6, new-6",q,16119,3,3-char,我在学习“平方米”。,I'm learning '平方米'.
方便面,方便麵,fāng biàn miàn,instant noodles,"newest-3, new-2",n,16225,3,3-char,这是方便面。,This is an instant noodles.
教育部,教育部,Jiào yù bù,Ministry of Education,new-6,nt,16284,3,3-char,这是教育部。,This is a Ministry of Education.
待会儿,待會兒,dāi huì r,in a moment; later; also pr. [dāi huǐ r] or [dāi hui r],new-6,d,16373,3,3-char,他待会儿来。,He comes in a moment.
转折点,轉折點,zhuǎn zhé diǎn,turning point; breaking point,"newest-7, new-7",n,16397,3,3-char,这是转折点。,This is a turning point.
一家人,一家人,yī jiā rén,household; the whole family,new-7,n,16475,3,3-char,这是一家人。,This is a household.
心里话,心裡話,xīn li huà,(to express one's) true feelings; what is on one's mind; secret mind,new-7,n,16506,3,3-char,这是心里话。,This is a true feelings.
少不了,少不了,shǎo bu liǎo,cannot do without; to be unavoidable; are bound to be many,"newest-7, new-7",v,16510,3,3-char,我每天都少不了。,I cannot do without every day.
瞧不起,瞧不起,qiáo bù qǐ,to look down upon; to hold in contempt,new-7,v,16626,3,3-char,我每天都瞧不起。,I to look down upon; to hold in contempt every day.
充电器,充電器,chōng diàn qì,battery charger,"new-4, old-5",n,16655,3,3-char,这是充电器。,This is a battery charger.
行李箱,行李箱,xíng li xiāng,suitcase; baggage compartment; overhead bin; (car) trunk; boot,old-3,n,16680,3,3-char,这是行李箱。,This is a suitcase.
高峰期,高峰期,gāo fēng qī,peak period; rush hour,new-7,n,16706,3,3-char,这是高峰期。,This is a peak period.
不客气,不客氣,bù kè qi,you're welcome; don't mention it; impolite; rude; blunt,"newest-1, new-1, old-1",,16723,3,3-char,我在学习“不客气”。,I'm learning '不客气'.
不景气,不景氣,bù jǐng qì,slack; in a slump,"newest-7, new-7",a,16728,3,3-char,这个很不景气。,This is very slack.
自信心,自信心,zì xìn xīn,self-confidence,new-7,n,16766,3,3-char,这是自信心。,This is a self-confidence.
演艺圈,演藝圈,yǎn yì quān,show business,new-7,n,16822,3,3-char,这是演艺圈。,This is a show business.
里程碑,里程碑,lǐ chéng bēi,milestone,"newest-7, new-7, old-6",n,16826,3,3-char,这是里程碑。,This is a milestone.
羽毛球,羽毛球,yǔ máo qiú,shuttlecock; badminton,"newest-3, new-5, old-4",n,16966,3,3-char,这是羽毛球。,This is a shuttlecock.
饮用水,飲用水,yǐn yòng shuǐ,drinking water; potable water,"newest-6, new-7",n,17077,3,3-char,这是饮用水。,This is a drinking water.
看得出,看得出,kàn de chū,can see; can tell,new-7,v,17140,3,3-char,我每天都看得出。,I can see every day.
一刹那,一剎那,yī chà nà,a moment; an instant; in a flash,new-7,t,17189,3,3-char,我们一刹那见。,See you a moment.
农产品,農產品,nóng chǎn pǐn,agricultural produce,"newest-6, new-5",n,17202,3,3-char,这是农产品。,This is an agricultural produce.
不见得,不見得,bù jiàn de,not necessarily; not likely,"newest-7, new-7, old-5",d,17256,3,3-char,他不见得来。,He comes not necessarily.
对得起,對得起,duì de qǐ,not to let sb down; to treat sb fairly; be worthy of,"newest-7, new-7",v,17263,3,3-char,我每天都对得起。,I not to let sb down every day.
水龙头,水龍頭,shuǐ lóng tóu,faucet; tap,"newest-7, new-7, old-6",n,17310,3,3-char,这是水龙头。,This is a faucet.
赶不上,趕不上,gǎn bù shàng,can't keep up with; can't catch up with; cannot overtake,new-6,,17330,3,3-char,我在学习“赶不上”。,I'm learning '赶不上'.
忘不了,忘不了,wàng bù liǎo,cannot forget,new-7,v,17402,3,3-char,我每天都忘不了。,I cannot forget every day.
交朋友,交朋友,jiāo péng you,to make friends; (dialect) to start an affair with sb,new-2,v,17456,3,3-char,我每天都交朋友。,I to make friends every day.
核电站,核電站,hé diàn zhàn,nuclear power plant,"newest-7, new-7",n,17531,3,3-char,这是核电站。,This is a nuclear power plant.
退休金,退休金,tuì xiū jīn,retirement pay; pension,new-7,n,17615,3,3-char,这是退休金。,This is a retirement pay.
清真寺,清真寺,qīng zhēn sì,mosque,new-7,n,17637,3,3-char,这是清真寺。,This is a mosque.
愈来愈,愈來愈,yù lái yù,more and more,new-7,d,17719,3,3-char,他愈来愈来。,He comes more and more.
演播室,演播室,yǎn bō shì,broadcasting studio,new-7,n,17796,3,3-char,这是演播室。,This is a broadcasting studio.
大幅度,大幅度,dà fú dù,by a wide margin; substantial,new-7,d,17856,3,3-char,他大幅度来。,He comes by a wide margin.
二手车,二手車,èr shǒu chē,second-hand car,new-7,n,17912,3,3-char,这是二手车。,This is a second-hand car.
工艺品,工藝品,gōng yì pǐn,handicraft article; handiwork,"new-5, old-6",n,18046,3,3-char,这是工艺品。,This is a handicraft article.
热水器,熱水器,rè shuǐ qì,water heater,"newest-6, new-6",n,18075,3,3-char,这是热水器。,This is a water heater.
下意识,下意識,xià yì shí,subconscious mind,"newest-7, new-7","n, v, d",18088,3,3-char,这是下意识。,This is a subconscious mind.
地下水,地下水,dì xià shuǐ,groundwater,"newest-7, new-7",n,18186,3,3-char,这是地下水。,This is a groundwater.
感染力,感染力,gǎn rǎn lì,"infectiousness (of a disease); appeal; power; impact (of an image, marketing message, performance etc)",new-7,n,18227,3,3-char,这是感染力。,This is an infectiousness.
真是的,真是的,zhēn shi de,Really! (interj. of annoyance or frustration),new-7,,18236,3,3-char,我在学习“真是的”。,I'm learning '真是的'.
女孩儿,女孩兒,nǚ hái r,erhua variant of 女孩; girl,"newest-2, new-1",,18271,3,3-char,我在学习“女孩儿”。,I'm learning '女孩儿'.
下功夫,下功夫,xià gōng fu,see 夫,"newest-6, new-7",v,18471,3,3-char,我每天都下功夫。,I see 夫 every day.
乘务员,乘務員,chéng wù yuán,"attendant on an airplane, train, boat etc","newest-5, old-6",n,18480,3,3-char,这是乘务员。,"This is an attendant on an airplane, train, boat etc."
世界观,世界觀,shì jiè guān,worldview; world outlook; Weltanschauung,old-6,n,18701,3,3-char,这是世界观。,This is a worldview.
积极性,積極性,jī jí xìng,zeal; initiative; enthusiasm; activity,new-3,n,18743,3,3-char,这是积极性。,This is a zeal.
机动车,機動車,jī dòng chē,motor vehicle,"newest-6, new-6",n,18763,3,3-char,这是机动车。,This is a motor vehicle.
仅次于,僅次於,jǐn cì yú,second only to ...; ranking behind only ...,new-7,v,18839,3,3-char,我每天都仅次于。,I second only to ...; ranking behind only ... every day.
五星级,五星級,wǔ xīng jí,five-star (hotel),new-7,b,18967,3,3-char,我在学习“五星级”。,I'm learning '五星级'.
原材料,原材料,yuán cái liào,raw and semifinished materials,"newest-6, new-7",n,18996,3,3-char,这是原材料。,This is a raw and semifinished materials.
俗话说,俗話說,sú huà shuō,as the proverb says; as they say...,new-7,v,19063,3,3-char,我每天都俗话说。,I as the proverb says every day.
节假日,節假日,jié jià rì,public holiday,"newest-4, new-6",t,19063,3,3-char,我们节假日见。,See you public holiday.
热气球,熱氣球,rè qì qiú,hot air balloon,new-7,n,19181,3,3-char,这是热气球。,This is a hot air balloon.
打喷嚏,打噴嚏,dǎ pēn tì,to sneeze,"newest-7, old-5",v,19233,3,3-char,我每天都打喷嚏。,I to sneeze every day.
国庆节,國慶節,Guó qìng jié,PRC National Day (October 1st),old-5,t,19292,3,3-char,我们国庆节见。,See you PRC National Day.
回忆录,回憶錄,huí yì lù,memoir,"newest-7, new-7",n,19388,3,3-char,这是回忆录。,This is a memoir.
零花钱,零花錢,líng huā qián,pocket money; allowance,"newest-4, new-7",n,19487,3,3-char,这是零花钱。,This is a pocket money.
空荡荡,空蕩蕩,kōng dàng dàng,empty; deserted,"newest-7, new-7",z,19536,3,3-char,我在学习“空荡荡”。,I'm learning '空荡荡'.
工商界,工商界,gōng shāng jiè,industry; the world of business,new-7,,19576,3,3-char,我在学习“工商界”。,I'm learning '工商界'.
单方面,單方面,dān fāng miàn,unilateral,"newest-7, new-7","d, n, b",19838,3,3-char,他单方面来。,He comes unilateral.
录音机,錄音機,lù yīn jī,(tape) recording machine; tape recorder,new-6,n,19867,3,3-char,这是录音机。,This is a recording machine.
职业病,職業病,zhí yè bìng,occupational disease,new-7,n,19943,3,3-char,这是职业病。,This is an occupational disease.
售货员,售貨員,shòu huò yuán,salesperson,"new-4, old-4",n,19954,3,3-char,这是售货员。,This is a salesperson.
大面积,大面積,dà miàn jī,large area; (fig.) (of a problem) (occurring) on a massive scale,new-7,"d, b",20060,3,3-char,他大面积来。,He comes large area.
一把手,一把手,yī bǎ shǒu,working hand; member of a work team; participant; the boss (short form of 手),new-7,n,20084,3,3-char,这是一把手。,This is a working hand; member of a work team; participant.
有效期,有效期,yǒu xiào qī,period of validity; sell-by date,new-7,n,20380,3,3-char,这是有效期。,This is a period of validity.
暗地里,暗地裡,àn dì li,secretly; inwardly; on the sly,"newest-7, new-7",d,20436,3,3-char,他暗地里来。,He comes secretly; inwardly; on the sly.
一点点,一點點,yī diǎn diǎn,a little bit,new-2,"t, m",20631,3,3-char,我们一点点见。,See you a little bit.
免不了,免不了,miǎn bù liǎo,unavoidable; can't be avoided,"newest-7, new-7",v,20777,3,3-char,我每天都免不了。,I unavoidable every day.
不由得,不由得,bù yóu de,can't help; cannot but,"newest-7, new-7, old-6",d,20909,3,3-char,他不由得来。,He comes can't help.
大熊猫,大熊貓,dà xióng māo,giant panda (Ailuropoda melanoleuca),"newest-3, new-5",n,21111,3,3-char,这是大熊猫。,This is a giant panda.
第一手,第一手,dì yī shǒu,first-hand,"newest-7, new-7","b, d, n",21139,3,3-char,我在学习“第一手”。,I'm learning '第一手'.
养老院,養老院,yǎng lǎo yuàn,nursing home,"newest-6, new-7",n,21201,3,3-char,这是养老院。,This is a nursing home.
手续费,手續費,shǒu xù fèi,service charge; processing fee; commission,new-6,n,21239,3,3-char,这是手续费。,This is a service charge.
失业率,失業率,shī yè lǜ,unemployment rate,new-7,n,21507,3,3-char,这是失业率。,This is an unemployment rate.
座右铭,座右銘,zuò yòu míng,motto; maxim,"newest-7, new-7, old-6",n,21583,3,3-char,这是座右铭。,This is a motto.
人民币,人民幣,rén mín bì,Renminbi (RMB); Chinese Yuan (CNY),"newest-5, new-3, old-4",n,21641,3,3-char,这是人民币。,This is a Renminbi.
老头儿,老頭兒,lǎo tóu r,see 老头子,new-3,n,21642,3,3-char,这是老头儿。,This is a see 老头子.
差点儿,差點兒,chà diǎn r,erhua variant of 差点; almost; nearly,"newest-4, new-5",d,21664,3,3-char,他差点儿来。,He comes erhua variant of 差点.
豁出去,豁出去,huō chu qu,to throw caution to the wind; to press one's luck; to go for broke,"newest-7, new-7",v,21778,3,3-char,我每天都豁出去。,I to throw caution to the wind every day.
百分比,百分比,bǎi fēn bǐ,percentage,"newest-7, new-7",n,21781,3,3-char,这是百分比。,This is a percentage.
发起人,發起人,fā qǐ rén,proposer; initiator; founding member,new-7,n,21812,3,3-char,这是发起人。,This is a proposer.
成问题,成問題,chéng wèn tí,to be a problem; problematic; questionable,new-7,v,21838,3,3-char,我每天都成问题。,I to be a problem every day.
起跑线,起跑線,qǐ pǎo xiàn,the starting line (of a race); scratch line (in a relay race),"newest-7, new-7",n,21839,3,3-char,这是起跑线。,This is a the starting line.
发源地,發源地,fā yuán dì,place of origin; birthplace; source,"newest-7, new-7",n,21846,3,3-char,这是发源地。,This is a place of origin.
追悼会,追悼會,zhuī dào huì,memorial service; funeral service,new-7,n,21919,3,3-char,这是追悼会。,This is a memorial service.
孤零零,孤零零,gū líng líng,lone; isolated and without help; all alone; solitary,"newest-7, new-7",z,22095,3,3-char,我在学习“孤零零”。,I'm learning '孤零零'.
好家伙,好家伙,hǎo jiā huo,my God!; oh boy!; man!,new-7,e,22176,3,3-char,我在学习“好家伙”。,I'm learning '好家伙'.
多方面,多方面,duō fāng miàn,many-sided; in many aspects,new-6,n,22207,3,3-char,这是多方面。,This is a many-sided.
老实说,老實說,lǎo shí shuō,"honestly speaking; to be frank, ...",new-7,,22207,3,3-char,我在学习“老实说”。,I'm learning '老实说'.
难为情,難為情,nán wéi qíng,embarrassed,"newest-7, new-7",a,22432,3,3-char,这个很难为情。,This is very embarrassed.
巴不得,巴不得,bā bu de,(coll.) to be eager for; to long for; to look forward to,"newest-7, new-7, old-6",v,22440,3,3-char,我每天都巴不得。,I to be eager for every day.
大体上,大體上,dà tǐ shàng,overall; in general terms,new-7,d,22444,3,3-char,他大体上来。,He comes overall.
导火索,導火索,dǎo huǒ suǒ,fuse (for explosive),"newest-7, new-7",n,22497,3,3-char,这是导火索。,This is a fuse.
交响乐,交響樂,jiāo xiǎng yuè,symphony,"newest-7, new-7",n,22508,3,3-char,这是交响乐。,This is a symphony.
开发区,開發區,kāi fā qū,development zone,"newest-7, new-7",n,22592,3,3-char,这是开发区。,This is a development zone.
登机牌,登機牌,dēng jī pái,boarding pass,old-5,n,22658,3,3-char,这是登机牌。,This is a boarding pass.
开场白,開場白,kāi chǎng bái,"prologue of play; opening remarks; preamble (of speeches, articles etc)","newest-7, new-7",n,22740,3,3-char,这是开场白。,This is a prologue of play.
立交桥,立交橋,lì jiāo qiáo,overpass; flyover,"newest-7, new-7, old-6",n,22789,3,3-char,这是立交桥。,This is an overpass.
说白了,說白了,shuō bái le,to speak frankly,new-7,,22831,3,3-char,我在学习“说白了”。,I'm learning '说白了'.
胆小鬼,膽小鬼,dǎn xiǎo guǐ,coward,"newest-7, old-5",n,22942,3,3-char,这是胆小鬼。,This is a coward.
基本功,基本功,jī běn gōng,basic skills; fundamentals,"newest-7, new-7",n,23233,3,3-char,这是基本功。,This is a basic skills.
领事馆,領事館,lǐng shì guǎn,consulate,"newest-7, new-7, old-6",n,23364,3,3-char,这是领事馆。,This is a consulate.
航天员,航天員,háng tiān yuán,astronaut,"newest-7, new-7",n,23387,3,3-char,这是航天员。,This is an astronaut.
好玩儿,好玩兒,hǎo wán r,erhua variant of 好玩; amusing; fun; interesting,"newest-1, new-1",a,23411,3,3-char,这个很好玩儿。,This is very erhua variant of 好玩.
写字楼,寫字樓,xiě zì lóu,office building,new-6,n,23538,3,3-char,这是写字楼。,This is an office building.
亲和力,親和力,qīn hé lì,(personal) warmth; approachability; accessibility; (in a product) user friendliness; (chemistry) affinity,"newest-7, new-7",n,23658,3,3-char,这是亲和力。,This is a warmth.
保质期,保質期,bǎo zhì qī,shelf life; expiration date,"newest-5, new-7",n,23667,3,3-char,这是保质期。,This is a shelf life.
元宵节,元宵節,Yuán xiāo jié,"Lantern Festival, the final event of the Spring Festival 春节, on 15th of first month of the lunar calendar","new-7, old-6",,23963,3,3-char,我在学习“元宵节”。,I'm learning '元宵节'.
看热闹,看熱鬧,kàn rè nao,to enjoy watching a bustling scene; to go where the crowds are,new-7,v,23986,3,3-char,我每天都看热闹。,I to enjoy watching a bustling scene every day.
留学生,留學生,liú xué shēng,student studying abroad; (foreign) exchange student,"newest-3, new-2",n,24084,3,3-char,这是留学生。,This is a student studying abroad.
热腾腾,熱騰騰,rè téng téng,steaming hot; (fig.) bustling; hectic; (fig.) excited; stirred up; (fig.) created only a short time before; freshly minted; hot off the press; (coll.) also pr. [rè tēng tēng],"newest-7, new-7",z,24091,3,3-char,我在学习“热腾腾”。,I'm learning '热腾腾'.
日用品,日用品,rì yòng pǐn,articles for daily use,"newest-5, old-5",n,24114,3,3-char,这是日用品。,This is an articles for daily use.
第一线,第一線,dì yī xiàn,front line; forefront,new-7,n,24169,3,3-char,这是第一线。,This is a front line.
甚至于,甚至於,shèn zhì yú,so much (that); even (to the extent that),new-7,d,24305,3,3-char,他甚至于来。,He comes so much.
用得着,用得著,yòng de zháo,to be able to use; useable; to have a use for; (in a question) to be necessary to,new-6,,24751,3,3-char,我在学习“用得着”。,I'm learning '用得着'.
茅台酒,茅臺酒,máo tái jiǔ,maotai (a Chinese liquor),new-7,,24755,3,3-char,我在学习“茅台酒”。,I'm learning '茅台酒'.
少林寺,少林寺,Shào lín Sì,"Shaolin Temple, Buddhist monastery famous for its kung fu monks",new-7,n,24852,3,3-char,这是少林寺。,"This is a Shaolin Temple, Buddhist monastery famous for its kung fu monks."
未知数,未知數,wèi zhī shù,unknown quantity,"newest-7, new-7",n,24868,3,3-char,这是未知数。,This is an unknown quantity.
一系列,一系列,yī xì liè,a series of; a string of,"newest-6, new-7",b,24973,3,3-char,我在学习“一系列”。,I'm learning '一系列'.
试用期,試用期,shì yòng qī,trial period; probationary period,new-7,"n, t",25091,3,3-char,这是试用期。,This is a trial period.
不像话,不像話,bù xiàng huà,unreasonable; shocking; outrageous,"newest-7, new-7, old-6",a,25125,3,3-char,这个很不像话。,This is very unreasonable.
亚运会,亞運會,Yà yùn huì,Asian Games,new-4,n,25188,3,3-char,这是亚运会。,This is an Asian Games.
共同体,共同體,gòng tóng tǐ,community,"newest-7, new-7",n,25376,3,3-char,这是共同体。,This is a community.
小孩儿,小孩兒,xiǎo hái r,erhua variant of 小孩; child,"newest-2, new-1",,25607,3,3-char,我在学习“小孩儿”。,I'm learning '小孩儿'.
评论员,評論員,píng lùn yuán,commentator,new-7,n,25625,3,3-char,这是评论员。,This is a commentator.
多功能,多功能,duō gōng néng,multifunctional; multifunction,new-7,b,25765,3,3-char,我在学习“多功能”。,I'm learning '多功能'.
按理说,按理說,àn lǐ shuō,it is reasonable to say that...,new-7,v,25769,3,3-char,我每天都按理说。,I it is reasonable to say that... every day.
清明节,清明節,Qīng míng jié,"Qingming or Pure Brightness Festival or Tomb Sweeping Day, celebration for the dead (in early April)",new-6,,26237,3,3-char,我在学习“清明节”。,I'm learning '清明节'.
伤脑筋,傷腦筋,shāng nǎo jīn,to be a real headache; to find sth a real headache; to beat one's brains,"newest-7, new-7, old-6",v,26254,3,3-char,我每天都伤脑筋。,I to be a real headache every day.
电动车,電動車,diàndòngchē,Electric vehicle,"newest-4, new-4",n,26291,3,3-char,这是电动车。,This is an Electric vehicle.
上班族,上班族,shàng bān zú,office workers (as social group),new-6,n,26506,3,3-char,这是上班族。,This is an office workers.
两口子,兩口子,liǎng kǒu zi,husband and wife,"newest-7, new-7",n,26774,3,3-char,这是两口子。,This is a husband and wife.
合作社,合作社,hé zuò shè,cooperative; workers' or agricultural producers' cooperative etc,new-7,n,26855,3,3-char,这是合作社。,This is a cooperative.
换言之,換言之,huàn yán zhī,in other words,new-7,cc,26895,3,3-char,我在学习“换言之”。,I'm learning '换言之'.
指南针,指南針,zhǐ nán zhēn,compass,"new-7, old-6",n,26990,3,3-char,这是指南针。,This is a compass.
洗衣粉,洗衣粉,xǐ yī fěn,laundry detergent; washing powder,new-6,n,27239,3,3-char,这是洗衣粉。,This is a laundry detergent.
菜市场,菜市場,cài shì chǎng,food market,new-7,n,27462,3,3-char,这是菜市场。,This is a food market.
出风头,出風頭,chū fēng tou,to push oneself forward; to seek fame; to be in the limelight; same as 出锋头,new-7,v,27500,3,3-char,我每天都出风头。,I to push oneself forward every day.
公安局,公安局,gōng ān jú,public security bureau (government office similar in function to a police station),"new-7, old-6",n,27713,3,3-char,这是公安局。,This is a public security bureau.
火辣辣,火辣辣,huǒ là là,painful heat; scorching; painful heat; rude and forthright; provocative; hot; sexy,"newest-7, new-7",z,27799,3,3-char,我在学习“火辣辣”。,I'm learning '火辣辣'.
乳制品,乳製品,rǔ zhì pǐn,dairy products,"newest-7, new-6",n,27890,3,3-char,这是乳制品。,This is a dairy products.
一揽子,一攬子,yī lǎn zi,all-inclusive; undiscriminating,"newest-7, new-7","l, q",27919,3,3-char,我在学习“一揽子”。,I'm learning '一揽子'.
易拉罐,易拉罐,yì lā guàn,pull-top can; easy-open can (with ring-pull),"newest-7, new-7",n,28228,3,3-char,这是易拉罐。,This is a pull-top can.
生命线,生命線,shēng mìng xiàn,lifeline,"newest-7, new-7",n,28405,3,3-char,这是生命线。,This is a lifeline.
高科技,高科技,gāo kē jì,high tech; high technology,"newest-5, new-6",n,28429,3,3-char,这是高科技。,This is a high tech; high technology.
圆珠笔,圓珠筆,yuán zhū bǐ,ballpoint pen,new-6,n,28444,3,3-char,这是圆珠笔。,This is a ballpoint pen.
居民楼,居民樓,jū mín lóu,apartment building; residential tower,new-7,n,28791,3,3-char,这是居民楼。,This is an apartment building.
浏览器,瀏覽器,liú lǎn qì,browser (software),"newest-6, new-7",n,28853,3,3-char,这是浏览器。,This is a browser.
急转弯,急轉彎,jí zhuǎn wān,to make a sudden turn,new-7,v,28882,3,3-char,我每天都急转弯。,I to make a sudden turn every day.
谈不上,談不上,tán bu shàng,to be out of the question,new-7,v,29056,3,3-char,我每天都谈不上。,I to be out of the question every day.
抚养费,撫養費,fǔ yǎng fèi,child support payment (after a divorce),new-7,n,29072,3,3-char,这是抚养费。,This is a child support payment.
温度计,溫度計,wēn dù jì,thermometer; thermograph,"newest-7, new-7",n,29216,3,3-char,这是温度计。,This is a thermometer.
中小学,中小學,zhōng xiǎo xué,middle and elementary school,new-2,n,29379,3,3-char,这是中小学。,This is a middle and elementary school.
教学楼,教學樓,jiào xué lóu,teaching block; school building,new-1,n,29517,3,3-char,这是教学楼。,This is a teaching block.
出主意,出主意,chū zhǔ yi,to come up with ideas; to make suggestions; to offer advice,new-7,,29537,3,3-char,我在学习“出主意”。,I'm learning '出主意'.
模特儿,模特兒,mó tè r,(fashion) model (loanword),"newest-6, new-4",,29610,3,3-char,我在学习“模特儿”。,I'm learning '模特儿'.
管理费,管理費,guǎn lǐ fèi,management fee,new-7,n,29984,3,3-char,这是管理费。,This is a management fee.
好容易,好容易,hǎo róng yì,"(idiomatic usage) with great difficulty; to have a hard time (convincing sb, relinquishing sth etc); (literal usage) so easy","newest-6, new-6",d,30322,3,3-char,他好容易来。,He comes with great difficulty.
中国画,中國畫,Zhōng guó huà,Chinese painting,new-7,,30455,3,3-char,我在学习“中国画”。,I'm learning '中国画'.
压岁钱,壓歲錢,yā suì qián,money given to children as a gift on Chinese New Year's Eve,"newest-5, old-6",n,30823,3,3-char,这是压岁钱。,This is a money given to children as a gift on Chinese New Year's Eve.
老字号,老字號,lǎo zì hào,"shop, firm, or brand of merchandise with a long-established reputation","newest-7, new-7",n,30827,3,3-char,这是老字号。,"This is a shop, firm, or brand of merchandise with a long-established reputation."
解说员,解說員,jiě shuō yuán,commentator,old-5,n,30960,3,3-char,这是解说员。,This is a commentator.
出毛病,出毛病,chū máo bìng,a problem appears; to break down,new-7,v,31186,3,3-char,我每天都出毛病。,I a problem appears every day.
顾不得,顧不得,gù bu de,unable to change sth; unable to deal with,new-7,v,31355,3,3-char,我每天都顾不得。,I unable to change sth every day.
礼拜天,禮拜天,Lǐ bài tiān,Sunday,old-5,t,31517,3,3-char,我们礼拜天见。,See you Sunday.
主题歌,主題歌,zhǔ tí gē,theme song,new-7,n,31573,3,3-char,这是主题歌。,This is a theme song.
太极拳,太極拳,tài jí quán,"shadowboxing or Taiji, T'aichi or T'aichichuan; traditional form of physical exercise or relaxation; a martial art","new-7, old-5",n,31592,3,3-char,这是太极拳。,"This is a shadowboxing or Taiji, T'aichi or T'aichichuan."
上进心,上進心,shàng jìn xīn,motivation; ambition,old-6,n,32278,3,3-char,这是上进心。,This is a motivation.
划时代,劃時代,huà shí dài,epoch-marking,"newest-7, new-7",b,32601,3,3-char,我在学习“划时代”。,I'm learning '划时代'.
不利于,不利於,bù lìyú,is harmful to,new-7,v,32766,3,3-char,我每天都不利于。,I is harmful to every day.
出难题,出難題,chū nán tí,to raise a tough question,new-7,v,32878,3,3-char,我每天都出难题。,I to raise a tough question every day.
