hanzi_simplified,hanzi_traditional,pinyin,english_meanings,hsk_levels,pos,frequency_rank,character_count,length_bucket,example_zh,example_en
克,克,Kè,"abbr. for 克罗地亚, Croatia; (Tw) abbr. for 克罗埃西亚, Croatia","newest-4, new-2, old-5","g, q, b, v",738,1,1-char,我在学习“克”。,I'm learning '克'.
装,裝,zhuāng,adornment; to adorn; dress; clothing; costume (of an actor in a play); to play a role; to pretend; to install; to fix; to wrap (sth in a bag); to load; to pack,"newest-4, new-2, old-5",v,741,1,1-char,我每天都装。,I adornment every day.
元,元,Yuán,surname Yuan; the Yuan or Mongol dynasty (1279-1368),"newest-1, new-1, old-2","q, tg",744,1,1-char,我在学习“元”。,I'm learning '元'.
座,座,zuò,"seat; base; stand; (archaic) suffix used in a respectful form of address, e.g. 师座; classifier for buildings, mountains and similar immovable objects","newest-4, new-2, old-4","q, g",751,1,1-char,我在学习“座”。,I'm learning '座'.
派,派,pài,clique; school; group; faction; to dispatch; to send; to assign; to appoint; pi (Greek letter Ππ); the circular ratio pi = 3.1415926; (loanword) pie,"newest-5, new-3, old-5","v, n, q",751,1,1-char,我每天都派。,I clique every day.
未,未,wèi,"not yet; did not; have not; not; 8th earthly branch: 1-3 p.m., 6th solar month (7th July-6th August), year of the Sheep; ancient Chinese compass point: 210°","newest-6, new-7",d,752,1,1-char,他未来。,He comes not yet.
包,包,Bāo,surname Bao,"newest-2, new-1, old-3","v, n, q",755,1,1-char,我每天都包。,I surname Bao every day.
入,入,rù,to enter; to go into; to join; to become a member of; to confirm or agree with; abbr. for 入声,"newest-4, new-6",v,756,1,1-char,我每天都入。,I to enter every day.
往,往,wǎng,to go (in a direction); to; towards; (of a train) bound for; past; previous,"newest-2, new-2, old-4","p, v",760,1,1-char,我往家来。,I come to go home.
哇,哇,wā,Wow!; sound of a child's crying; sound of vomiting,"newest-6, new-6, old-6","y, o",762,1,1-char,我在学习“哇”。,I'm learning '哇'.
眼,眼,yǎn,"eye; small hole; crux (of a matter); classifier for big hollow things (wells, stoves, pots etc)","newest-5, new-2","n, q",762,1,1-char,这是眼。,This is an eye.
楼,樓,Lóu,surname Lou,"newest-2, new-1, old-3",n,765,1,1-char,这是楼。,This is a surname Lou.
主,主,zhǔ,owner; master; host; individual or party concerned; God; Lord; main; to indicate or signify; trump card (in card games),new-7,"g, n, b",768,1,1-char,我在学习“主”。,I'm learning '主'.
停,停,tíng,to stop; to halt; to park (a car),"newest-4, new-2",v,768,1,1-char,我每天都停。,I to stop every day.
气,氣,qì,gas; air; smell; weather; to make angry; to annoy; to get angry; vital energy; qi,"newest-4, new-2","n, v",772,1,1-char,这是气。,This is a gas; air.
性,性,xìng,"nature; character; property; quality; attribute; sexuality; sex; gender; suffix forming adjective from verb; suffix forming noun from adjective, corresponding to -ness or -ity; essence","newest-4, new-3","g, n, k",775,1,1-char,我在学习“性”。,I'm learning '性'.
令,令,líng,used in 令; used in 狐 (Taiwan pr. [lìng]),"newest-5, new-5","v, g",776,1,1-char,我每天都令。,I used in 令 every day.
飞,飛,fēi,to fly,"newest-2, new-1","v, g, vn",779,1,1-char,我每天都飞。,I to fly every day.
倒,倒,dǎo,to fall; to collapse; to lie horizontally; to fail; to go bankrupt; to overthrow; to change (trains or buses); to move around; to resell at a profit,"newest-4, new-2, old-5","v, d",780,1,1-char,我每天都倒。,I to fall; to collapse; to lie horizontally every day.
神,神,Shén,God; abbr. for 舟,"newest-6, new-5","n, a",786,1,1-char,这是神。,This is a God.
酒,酒,jiǔ,wine (esp. rice wine); liquor; spirits; alcoholic beverage,"newest-3, new-2",n,788,1,1-char,这是酒。,This is a wine.
红,紅,Hóng,surname Hong,"newest-5, new-2, old-2","a, v, g",794,1,1-char,这个很红。,This is very surname Hong.
抓,抓,zhuā,to grab; to catch; to arrest; to snatch; to scratch,"newest-5, new-3",v,797,1,1-char,我每天都抓。,I to grab every day.
约,約,yāo,to weigh in a balance or on a scale,"newest-4, new-3","d, b, v, g",797,1,1-char,他约来。,He comes to weigh in a balance or on a scale.
光,光,guāng,light; ray; bright; shiny; only; merely; used up; finished; to leave (a part of the body) uncovered,"newest-4, new-3, old-4","n, d, v, a",800,1,1-char,这是光。,This is a light; ray.
六,六,liù,six; 6,"newest-1, new-1, old-1","m, t",802,1,1-char,我有三六。,I have three six.
边,邊,biān,side; edge; margin; border; boundary; simultaneously,"newest-1, new-2","k, d, n",803,1,1-char,我在学习“边”。,I'm learning '边'.
便,便,biàn,plain; informal; suitable; convenient; opportune; to urinate or defecate; equivalent to 就: then; in that case; even if; soon afterwards,"newest-5, new-6, old-5","d, g",811,1,1-char,他便来。,He comes plain.
唱,唱,chàng,to sing; to call loudly; to chant,"newest-1, new-1",v,813,1,1-char,我每天都唱。,I to sing every day.
近,近,jìn,near; close to; approximately,"newest-2, new-2, old-2","a, v",822,1,1-char,这个很近。,This is very near.
病,病,bìng,illness; disease; to fall ill; defect,"newest-1, new-1","n, v",827,1,1-char,这是病。,This is an illness.
金,金,Jīn,surname Jin; surname Kim (Korean); Jurchen Jin dynasty (1115-1234),new-3,"b, g, nr, tg",828,1,1-char,我在学习“金”。,I'm learning '金'.
收,收,shōu,to receive; to accept; to collect; to put away; to restrain; to stop; in care of (used on address line after name),"newest-3, new-2, old-4",v,834,1,1-char,我每天都收。,I to receive every day.
项,項,Xiàng,surname Xiang,"newest-4, new-4, old-5",q,837,1,1-char,我在学习“项”。,I'm learning '项'.
底,底,de,(equivalent to 的 as possessive particle),"newest-4, new-4, old-4","f, n",849,1,1-char,我在学习“底”。,I'm learning '底'.
力,力,Lì,surname Li,"newest-5, new-3","n, g",851,1,1-char,这是力。,This is a surname Li.
数,數,shǔ,to count; to count as; to regard as; to enumerate; to list,"newest-4, new-2, old-6","m, n, v",852,1,1-char,我有三数。,I have three to count.
忙,忙,máng,busy; hurriedly; to hurry; to rush,"newest-1, new-1, old-2","v, a, ad, g, an",859,1,1-char,我每天都忙。,I busy every day.
谈,談,Tán,surname Tan,"newest-4, new-3, old-4","v, g",862,1,1-char,我每天都谈。,I surname Tan every day.
十,十,shí,ten; 10,"newest-1, new-1, old-1","m, t",865,1,1-char,我有三十。,I have three ten.
城,城,chéng,city walls; city; town,"newest-4, new-3",n,892,1,1-char,这是城。,This is a city walls.
哭,哭,kū,to cry; to weep,"newest-3, new-2, old-3",v,898,1,1-char,我每天都哭。,I to cry; to weep every day.
怕,怕,Pà,surname Pa,"newest-3, new-2",v,899,1,1-char,我每天都怕。,I surname Pa every day.
敢,敢,gǎn,to dare; daring; (polite) may I venture,"newest-4, new-3, old-3","v, g",902,1,1-char,我每天都敢。,I to dare every day.
离,离,chī,mythical beast (archaic),"newest-2, new-2, old-2","v, p",912,1,1-char,我每天都离。,I mythical beast every day.
字,字,zì,letter; symbol; character; word; courtesy or style name traditionally given to males aged 20 in dynastic China,"newest-1, new-1, old-1",n,913,1,1-char,这是字。,This is a letter.
某,某,mǒu,some; a certain; sb or sth indefinite; such-and-such,"newest-5, new-3, old-5",r,913,1,1-char,我在学习“某”。,I'm learning '某'.
梦,夢,mèng,dream; (bound form) to dream,"newest-4, new-4, old-4","n, g",913,1,1-char,这是梦。,This is a dream.
支,支,Zhī,surname Zhi,"newest-5, new-3, old-5","q, v",915,1,1-char,我在学习“支”。,I'm learning '支'.
随,隨,Suí,surname Sui,"newest-5, new-3","p, v, g",915,1,1-char,我随家来。,I come surname Sui home.
提,提,dī,used in 防 and 溜,"newest-4, new-2, old-5",v,919,1,1-char,我每天都提。,I used in 防 and 溜 every day.
度,度,dù,"to pass; to spend (time); measure; limit; extent; degree of intensity; degree (angles, temperature etc); kilowatt-hour; classifier for events and occurrences","newest-5, new-2","qv, v, g",925,1,1-char,我在学习“度”。,I'm learning '度'.
白,白,Bái,surname Bai,"newest-5, new-1, old-2","a, nr, d, b, v, g",930,1,1-char,这个很白。,This is very surname Bai.
单,單,Shàn,surname Shan,"newest-5, new-4","d, b, g",931,1,1-char,他单来。,He comes surname Shan.
热,熱,rè,to warm up; to heat up; hot (of weather); heat; fervent,"newest-1, new-1, old-1","a, n, k, v, ad, an",938,1,1-char,这个很热。,This is very to warm up.
试,試,shì,to test; to try; experiment; examination; test,"newest-3, new-1, old-4","v, vn",938,1,1-char,我每天都试。,I to test every day.
感,感,gǎn,to feel; to move; to touch; to affect; feeling; emotion; (suffix) sense of ~,"newest-4, new-7",g,939,1,1-char,我在学习“感”。,I'm learning '感'.
至,至,zhì,to arrive; most; to; until,"newest-5, new-5","p, v, g",941,1,1-char,我至家来。,I come to arrive home.
非,非,Fēi,"abbr. for 洲, Africa","newest-7, new-4, old-5",b,949,1,1-char,我在学习“非”。,I'm learning '非'.
低,低,dī,low; beneath; to lower (one's head); to let droop; to hang down; to incline,"newest-4, new-2, old-3","a, ad, v",951,1,1-char,这个很低。,This is very low.
弄,弄,lòng,lane; alley,"newest-4, new-2, old-4",v,952,1,1-char,我每天都弄。,I lane every day.
赢,贏,yíng,to beat; to win; to profit,"newest-4, new-3, old-4",v,952,1,1-char,我每天都赢。,I to beat every day.
票,票,piào,"ticket; ballot; banknote; person held for ransom; amateur performance of Chinese opera; classifier for groups, batches, business transactions","newest-2, new-1, old-2","n, q",956,1,1-char,这是票。,This is a ticket.
西,西,Xī,the West; abbr. for Spain 牙; Spanish,"newest-3, new-1, old-3","f, b",958,1,1-char,我在学习“西”。,I'm learning '西'.
床,床,chuáng,bed; couch; classifier for beds,"newest-2, new-1","n, q",961,1,1-char,这是床。,This is a bed.
满,滿,Mǎn,Manchu ethnic group,"newest-4, new-2, old-4","a, v, d, b",961,1,1-char,这个很满。,This is very Manchu ethnic group.
第,第,dì,"(prefix indicating ordinal number, as in 六 ""sixth""); (literary) grades in which successful candidates in the imperial examinations were placed; (old) residence of a high official; (literary) but; however; (literary) only; just","newest-1, new-1",m,962,1,1-char,我有三第。,I have three item.
则,則,zé,(literary) (conjunction used to express contrast with a previous clause) but; then; (bound form) standard; norm; (bound form) principle; (literary) to imitate; to follow; classifier for written items,"newest-6, new-7, old-5","d, c, q, g",966,1,1-char,他则来。,He comes but; then.
情,情,qíng,feeling; emotion; passion; situation,new-7,"n, g",966,1,1-char,这是情。,This is a feeling.
报,報,bào,to announce; to inform; report; newspaper; recompense; revenge,"newest-7, new-3","n, v",967,1,1-char,这是报。,This is a to announce.
差,差,chā,difference; discrepancy; (math.) difference (amount remaining after a subtraction); (literary) a little; somewhat; slightly,"newest-3, new-1, old-3","a, v, g",968,1,1-char,这个很差。,This is very difference; discrepancy.
步,步,Bù,surname Bu,"newest-4, new-3","qv, n, v",972,1,1-char,我在学习“步”。,I'm learning '步'.
短,短,duǎn,short; brief; to lack; weak point; fault,"newest-3, new-2, old-3",a,983,1,1-char,这个很短。,This is very short.
教,教,Jiào,surname Jiao,"newest-2, new-1, old-3","v, g",988,1,1-char,我每天都教。,I surname Jiao every day.
啥,啥,shá,dialectal equivalent of 什么; also pr. [shà],old-6,r,990,1,1-char,我在学习“啥”。,I'm learning '啥'.
应,應,Yīng,surname Ying; Taiwan pr. [Yìng],"newest-7, new-4",v,999,1,1-char,我每天都应。,I surname Ying every day.
据,㨿,jù,variant of 据,"newest-5, new-6","p, g",1000,1,1-char,我据家来。,I come variant of 据 home.
查,查,Zhā,surname Zha,"newest-3, new-2",v,1010,1,1-char,我每天都查。,I surname Zha every day.
方,方,Fāng,surname Fang,"newest-5, new-4, old-5","q, d, g, a, f, b",1012,1,1-char,我在学习“方”。,I'm learning '方'.
读,讀,dòu,comma; phrase marked by pause,"newest-1, new-1, old-1",v,1013,1,1-char,我每天都读。,I comma every day.
深,㴱,shēn,old variant of 深,"newest-4, new-3, old-4","a, d, g, b",1014,1,1-char,这个很深。,This is very old variant of 深.
忘,忘,wàng,to forget; to overlook; to neglect,"newest-2, new-1",v,1015,1,1-char,我每天都忘。,I to forget every day.
清,清,Qīng,Qing (Wade-Giles: Ch'ing) dynasty of imperial China (1644-1911); surname Qing,"newest-6, new-6","a, v, tg",1019,1,1-char,这个很清。,This is very Qing  dynasty of imperial China.
各,各,gè,each; every,"newest-4, new-3, old-4",r,1022,1,1-char,我在学习“各”。,I'm learning '各'.
脚,腳,jiǎo,foot; leg (of an animal or an object); base (of an object); classifier for kicks,"newest-3, new-2, old-3","n, q",1024,1,1-char,这是脚。,This is a foot.
冷,冷,Lěng,surname Leng,"newest-1, new-1, old-1","a, ad, g",1027,1,1-char,这个很冷。,This is very surname Leng.
电,電,diàn,lightning; electricity; electric (bound form); to get (or give) an electric shock; phone call or telegram etc; to send via telephone or telegram etc,"newest-3, new-1",n,1027,1,1-char,这是电。,This is a lightning.
山,山,Shān,surname Shan,"newest-3, new-1",n,1030,1,1-char,这是山。,This is a surname Shan.
秒,秒,miǎo,second (unit of time); arc second (angular measurement unit); (coll.) instantly,"newest-4, new-5, old-5","t, qt",1034,1,1-char,我们秒见。,See you second.
王,王,Wáng,surname Wang,new-4,"n, nr",1039,1,1-char,这是王。,This is a surname Wang.
市,市,shì,market; city,"newest-3, new-2",n,1040,1,1-char,这是市。,This is a market.
亲,親,qīn,parent; one's own (flesh and blood); relative; related; marriage; bride; close; intimate; in person; first-hand; in favor of; pro-; to kiss; (Internet slang) dear,"newest-5, new-3","v, a, ad, g",1044,1,1-char,我每天都亲。,I parent every day.
仍,仍,réng,still; yet; to remain; (literary) frequently; often,"newest-4, new-3",d,1050,1,1-char,他仍来。,He comes still; yet.
假,假,gēi,used in 掰,"newest-4, new-2, old-4","a, ad, n, g",1053,1,1-char,这个很假。,This is very used in 掰.
常,常,Cháng,surname Chang,"newest-3, new-1","d, nr",1057,1,1-char,他常来。,He comes surname Chang.
嘴,嘴,zuǐ,mouth; beak; nozzle; spout (of teapot etc),"newest-3, new-2, old-4",n,1059,1,1-char,这是嘴。,This is a mouth.
轮,輪,lún,"wheel; disk; ring; steamship; to take turns; to rotate; classifier for big round objects: disk, or recurring events: round, turn","newest-6, new-4","qv, g, v",1066,1,1-char,我在学习“轮”。,I'm learning '轮'.
改,改,gǎi,to change; to alter; to transform; to correct,"newest-4, new-2",v,1070,1,1-char,我每天都改。,I to change every day.
投,投,tóu,to cast; to send; to throw oneself (into the river etc); to seek refuge; to place oneself into the hands of,"newest-5, new-4",v,1081,1,1-char,我每天都投。,I to cast every day.
省,省,shěng,to save; to economize; to be frugal; to omit; to delete; to leave out; province; provincial capital; a ministry (of the Japanese government),"newest-4, new-2, old-4","n, v",1081,1,1-char,这是省。,This is a to save; to economize; to be frugal.
夜,亱,yè,variant of 夜,"newest-4, new-2, old-5","tg, qt",1082,1,1-char,我们夜见。,See you variant of 夜.
海,海,Hǎi,surname Hai,"newest-3, new-2","n, nr",1082,1,1-char,这是海。,This is a surname Hai.
仅,僅,jǐn,barely; only; merely,"newest-4, new-3",d,1086,1,1-char,他仅来。,He comes barely.
陪,陪,péi,to accompany; to keep sb company; to assist; old variant of 赔,"newest-4, new-5, old-4",v,1090,1,1-char,我每天都陪。,I to accompany every day.
挂,掛,guà,to hang or suspend (from a hook etc); to hang up (the phone); (of a line) to be dead; to be worried or concerned; to make a phone call (dialect); to register or record; classifier for sets or clusters of objects; (slang) to kill; to die; to be finished; to fail (an exam),"newest-4, new-3, old-4","v, q",1092,1,1-char,我每天都挂。,I to hang or suspend every day.
类,類,lèi,kind; type; class; category; similar; like; to resemble,"newest-5, new-3, old-5","q, n, g",1096,1,1-char,我在学习“类”。,I'm learning '类'.
跳,跳,tiào,to jump; to hop; to skip over; to bounce; to palpitate,"newest-3, new-3","v, vn, q",1099,1,1-char,我每天都跳。,I to jump every day.
称,稱,chèn,to fit; balanced; suitable,"newest-5, new-2","v, g, vn",1100,1,1-char,我每天都称。,I to fit every day.
久,久,jiǔ,(long) time; (long) duration of time,"newest-3, new-3, old-3","a, g, ad",1103,1,1-char,这个很久。,This is very time.
画,畫,huà,to draw; to paint; picture; painting; to draw (a line) (variant of 划); stroke of a Chinese character (variant of 划); (calligraphy) horizontal stroke (variant of 划),"newest-2, new-2, old-3","n, v, q",1119,1,1-char,这是画。,This is a to draw; to paint.
逼,偪,bī,variant of 逼; to compel; to pressure,"newest-6, new-6",v,1122,1,1-char,我每天都逼。,I variant of 逼 every day.
记,記,jì,"to record; to note; to memorize; to remember; mark; sign; classifier for blows, kicks, shots","newest-3, new-1","v, g, q",1123,1,1-char,我每天都记。,I to record every day.
关,關,Guān,surname Guan,"newest-3, new-1, old-3","v, n, nr",1129,1,1-char,我每天都关。,I surname Guan every day.
哥,哥,gē,elder brother,new-1,n,1132,1,1-char,这是哥。,This is an elder brother.
爸,爸,bà,father; dad; pa; papa,new-1,n,1142,1,1-char,这是爸。,This is a father.
牛,牛,Niú,surname Niu,"newest-3, new-3","n, g, nr",1148,1,1-char,这是牛。,This is a surname Niu.
猫,貓,māo,cat; (dialect) to hide oneself; (coll.) modem,"newest-1, new-2, old-1","n, v",1150,1,1-char,这是猫。,This is a cat.
风,風,fēng,wind; news; style; custom; manner,"newest-3, new-1","n, g",1150,1,1-char,这是风。,This is a wind.
通,通,tōng,"to go through; to know well; (suffix) expert; to connect; to communicate; open; to clear; classifier for letters, telegrams, phone calls etc","newest-4, new-2","v, a, qv",1155,1,1-char,我每天都通。,I to go through every day.
照,炤,zhào,variant of 照; to shine; to illuminate,"newest-3, new-3","v, p, g, d",1165,1,1-char,我每天都照。,I variant of 照 every day.
群,羣,qún,variant of 群,"newest-5, new-3, old-4","q, g",1165,1,1-char,我在学习“群”。,I'm learning '群'.
够,夠,gòu,enough (sufficient); enough (too much); (coll.) (before adj.) really; (coll.) to reach by stretching out,"newest-4, new-2, old-4","v, d",1173,1,1-char,我每天都够。,I enough every day.
德,德,Dé,Germany; German; abbr. for 德国,new-7,"n, b",1174,1,1-char,这是德。,This is a Germany.
原,原,Yuán,surname Yuan; (Japanese surname) Hara,"newest-5, new-6","b, d",1178,1,1-char,我在学习“原”。,I'm learning '原'.
根,根,gēn,"root; basis; classifier for long slender objects, e.g. cigarettes, guitar strings; radical (chemistry)","newest-5, new-4, old-5","q, n",1181,1,1-char,我在学习“根”。,I'm learning '根'.
火,火,Huǒ,surname Huo,"newest-4, new-3, old-4","n, a, v",1181,1,1-char,这是火。,This is a surname Huo.
赛,賽,sài,to compete; competition; match; to surpass; better than; superior to; to excel,"newest-7, new-6","vn, v",1181,1,1-char,我每天都赛。,I to compete every day.
排,排,pái,"a row; a line; to set in order; to arrange; to line up; to eliminate; to drain; to push open; platoon; raft; classifier for lines, rows etc","newest-4, new-2","v, q, n",1188,1,1-char,我每天都排。,I a row every day.
鱼,魚,Yú,surname Yu,"newest-2, new-2, old-2",n,1189,1,1-char,这是鱼。,This is a surname Yu.
集,集,jí,to gather; to collect; collected works; classifier for sections of a TV series etc: episode,"newest-5, new-6","q, g",1190,1,1-char,我在学习“集”。,I'm learning '集'.
抢,搶,qiāng,(literary) to knock against (esp. to knock one's head on the ground in grief or rage); opposite in direction; contrary,"newest-5, new-5, old-5",v,1191,1,1-char,我每天都抢。,I to knock against every day.
节,節,jiē,see 节骨眼,"newest-3, new-2, old-5","n, q, g, v",1196,1,1-char,这是节。,This is a see 节骨眼.
傻,傻,shǎ,foolish,"newest-5, new-5, old-5","a, an",1197,1,1-char,这个很傻。,This is very foolish.
祝,祝,Zhù,surname Zhu,"newest-4, new-3, old-3","v, nr",1197,1,1-char,我每天都祝。,I surname Zhu every day.
累,累,lěi,to accumulate; to involve or implicate (Taiwan pr. [lèi]); continuous; repeated,"newest-2, new-1, old-2","a, v, an",1197,1,1-char,这个很累。,This is very to accumulate.
取,取,qǔ,to take; to get; to choose; to fetch,"newest-4, new-2, old-4",v,1198,1,1-char,我每天都取。,I to take every day.
权,權,Quán,surname Quan,"newest-5, new-6",n,1198,1,1-char,这是权。,This is a surname Quan.
层,層,céng,to pile on top of one another; layer; stratum; floor (of a building); story; (math.) sheaf; classifier for layers,"newest-3, new-2, old-3","qv, n",1202,1,1-char,我在学习“层”。,I'm learning '层'.
乱,亂,luàn,in confusion or disorder; in a confused state of mind; disorder; upheaval; riot; illicit sexual relations; to throw into disorder; to mix up; indiscriminate; random; arbitrary,"newest-4, new-3, old-4","d, a, v",1206,1,1-char,他乱来。,He comes in confusion or disorder.
待,待,dāi,to stay,"newest-4, new-5","v, p",1207,1,1-char,我每天都待。,I to stay every day.
肉,肉,ròu,meat; flesh; pulp (of a fruit); (coll.) (of a fruit) squashy; (of a person) flabby; irresolute; Kangxi radical 130,"newest-2, new-1",n,1215,1,1-char,这是肉。,This is a meat.
腿,腿,tuǐ,leg,"newest-3, new-2, old-3",n,1216,1,1-char,这是腿。,This is a leg.
救,捄,jiù,variant of 救,"newest-5, new-3, old-5","v, vn",1217,1,1-char,我每天都救。,I variant of 救 every day.
共,共,gòng,"common; general; to share; together; total; altogether; abbr. for 共产党, Communist party","newest-4, new-4","d, g, b",1227,1,1-char,他共来。,He comes common.
尽,儘,jǐn,to the greatest extent; (when used before a noun of location) furthest or extreme; to be within the limits of; to give priority to,"newest-6, new-6","v, d",1228,1,1-char,我每天都尽。,I to the greatest extent every day.
棒,棒,bàng,stick; club; cudgel; smart; capable; strong; wonderful; classifier for legs of a relay race,"newest-4, new-5, old-5","a, g, q",1228,1,1-char,这个很棒。,This is very stick.
图,圖,tú,diagram; picture; drawing; chart; map; to plan; to scheme; to attempt; to pursue; to seek,"newest-4, new-3","n, v",1231,1,1-char,这是图。,This is a diagram.
街,街,jiē,street,"newest-3, new-2",n,1234,1,1-char,这是街。,This is a street.
抱,抱,bào,to hold; to carry (in one's arms); to hug; to embrace; to surround; to cherish; (coll.) (of clothes) to fit nicely,"newest-4, new-4, old-4",v,1238,1,1-char,我每天都抱。,I to hold every day.
班,班,Bān,surname Ban,"newest-2, new-1, old-3","n, q, nr",1238,1,1-char,这是班。,This is a surname Ban.
利,利,Lì,surname Li,new-6,"n, g",1239,1,1-char,这是利。,This is a surname Li.
坏,壞,huài,bad; spoiled; broken; to break down; (suffix) to the utmost,"newest-2, new-1, old-3","a, v",1239,1,1-char,这个很坏。,This is very bad.
笔,筆,bǐ,"pen; pencil; writing brush; to write or compose; the strokes of Chinese characters; classifier for sums of money, deals","newest-2, new-2","q, n",1245,1,1-char,我在学习“笔”。,I'm learning '笔'.
鞋,鞋,xié,shoe,"newest-3, new-2, old-3",n,1249,1,1-char,这是鞋。,This is a shoe.
痛,痛,tòng,ache; pain; sorrow; deeply; thoroughly,"newest-4, new-3","a, g, an",1254,1,1-char,这个很痛。,This is very ache.
追,追,duī,to sculpt; to carve; musical instrument (old),"newest-5, new-3",v,1265,1,1-char,我每天都追。,I to sculpt every day.
破,破,pò,"broken; damaged; worn out; lousy; rotten; to break, split or cleave; to get rid of; to destroy; to break with; to defeat; to capture (a city etc); to expose the truth of","newest-4, new-3, old-4","v, a",1272,1,1-char,我每天都破。,I broken every day.
推,推,tuī,to push; to cut; to refuse; to reject; to decline; to shirk (responsibility); to put off; to delay; to push forward; to nominate; to elect; massage,"newest-4, new-2, old-4",v,1277,1,1-char,我每天都推。,I to push every day.
刀,刀,Dāo,surname Dao,"newest-4, new-3, old-4","n, q",1285,1,1-char,这是刀。,This is a surname Dao.
反,反,fǎn,contrary; in reverse; inside out or upside down; to reverse; to return; to oppose; opposite; against; anti-; to rebel; to use analogy; instead; abbr. for 切 phonetic system,"newest-5, new-4","v, b, d",1290,1,1-char,我每天都反。,I contrary every day.
油,油,yóu,"oil; fat; grease; petroleum; to apply tung oil, paint or varnish; oily; greasy; glib; cunning","newest-4, new-2",n,1290,1,1-char,这是油。,This is an oil.
传,傳,chuán,to pass on; to spread; to transmit; to infect; to transfer; to circulate; to conduct (electricity),"newest-5, new-3","v, g, vn",1294,1,1-char,我每天都传。,I to pass on every day.
洗,洗,xǐ,to wash; to bathe; to develop (photographs); to shuffle (cards etc); to erase (a recording),"newest-2, new-1, old-2",v,1298,1,1-char,我每天都洗。,I to wash; to bathe every day.
喂,喂,wéi,hello (when answering the phone),"newest-1, new-2, old-1","v, e",1301,1,1-char,我每天都喂。,I hello every day.
