hanzi_simplified,hanzi_traditional,pinyin,english_meanings,hsk_levels,pos,frequency_rank,character_count,length_bucket,example_zh,example_en
戳,戳,chuō,to jab; to poke; to stab; (coll.) to sprain; to blunt; to fuck (vulgar); to stand; to stand (sth) upright; stamp; seal,"newest-7, new-7",v,5113,1,1-char,我每天都戳。,I to jab every day.
钉,釘,dīng,nail; to follow closely; to keep at sb (to do sth); variant of 盯,"newest-7, new-7",v,5126,1,1-char,我每天都钉。,I nail every day.
魂,䰟,hún,old variant of 魂,new-7,n,5167,1,1-char,这是魂。,This is an old variant of 魂.
债,債,zhài,debt,"newest-7, new-6",n,5172,1,1-char,这是债。,This is a debt.
耐,耐,nài,(bound form) to bear; to endure; to withstand,"newest-7, new-7",v,5195,1,1-char,我每天都耐。,I to bear; to endure; to withstand every day.
鹰,鷹,yīng,eagle; falcon; hawk,"newest-7, new-7",n,5195,1,1-char,这是鹰。,This is an eagle.
赔,賠,péi,to compensate for loss; to indemnify; to suffer a financial loss,"newest-5, new-5",v,5207,1,1-char,我每天都赔。,I to compensate for loss every day.
略,略,lu:è,brief; sketchy; outline; summary; to omit; (bound form before a single-character verb) a bit; somewhat; slightly; plan; strategy; to capture (territory),"newest-7, new-7","d, g",5208,1,1-char,他略来。,He comes brief; sketchy.
摘,摘,zhāi,"to take; to borrow; to pick (flowers, fruit etc); to pluck; to select; to remove; to take off (glasses, hat etc)","newest-5, new-5, old-5",v,5217,1,1-char,我每天都摘。,I to take every day.
扁,扁,Piān,surname Pian,"newest-7, new-6, old-6",a,5218,1,1-char,这个很扁。,This is very surname Pian.
撤,撤,chè,to remove; to take away,"newest-7, new-7",v,5225,1,1-char,我每天都撤。,I to remove; to take away every day.
糟,糟,zāo,dregs; draff; pickled in wine; rotten; messy; ruined,"newest-5, new-5","a, v",5229,1,1-char,这个很糟。,This is very dregs.
呵,呵,ā,variant of 啊,"newest-7, old-6","y, e, v",5230,1,1-char,我在学习“呵”。,I'm learning '呵'.
冬,冬,dōng,winter,old-3,tg,5272,1,1-char,我们冬见。,See you winter.
吞,吞,tūn,to swallow; to take,"newest-6, new-6",v,5282,1,1-char,我每天都吞。,I to swallow every day.
玉,玉,yù,jade,"newest-7, new-4",n,5296,1,1-char,这是玉。,This is a jade.
歪,歪,wāi,askew; at a crooked angle; devious; noxious; (coll.) to lie on one's side,"newest-6, new-7, old-5","a, v",5307,1,1-char,这个很歪。,This is very askew.
跪,跪,guì,to kneel,"newest-6, new-6, old-6",v,5311,1,1-char,我每天都跪。,I to kneel every day.
棉,棉,mián,generic term for cotton or kapok; cotton; padded or quilted with cotton,"newest-6, new-6","g, n",5317,1,1-char,我在学习“棉”。,I'm learning '棉'.
废,廢,fèi,to abolish; to abandon; to abrogate; to discard; to depose; to oust; crippled; abandoned; waste,"newest-7, new-7","g, v",5340,1,1-char,我在学习“废”。,I'm learning '废'.
缠,纏,chán,to wind around; to wrap round; to coil; tangle; to involve; to bother; to annoy,"newest-7, new-7",v,5340,1,1-char,我每天都缠。,I to wind around every day.
顾,顧,Gù,surname Gu,"newest-6, new-6","v, nr",5341,1,1-char,我每天都顾。,I surname Gu every day.
潮,潮,cháo,tide; damp; moist; humid; fashionable; trendy; (coll.) inferior; substandard,"newest-7, new-4",n,5342,1,1-char,这是潮。,This is a tide.
押,押,yā,to mortgage; to pawn; to detain in custody; to escort and protect; (literary) to sign,"newest-7, new-7",v,5343,1,1-char,我每天都押。,I to mortgage every day.
鹿,鹿,lù,deer,"newest-7, new-7",n,5364,1,1-char,这是鹿。,This is a deer.
幢,幢,chuáng,banner,"newest-7, new-7, old-6",q,5366,1,1-char,我在学习“幢”。,I'm learning '幢'.
担,擔,dān,to undertake; to carry; to shoulder; to take responsibility,"newest-7, new-7","v, q, g",5380,1,1-char,我每天都担。,I to undertake every day.
兹,茲,zī,now; here; this; time; year,"newest-7, new-7",Rg,5397,1,1-char,我在学习“兹”。,I'm learning '兹'.
虾,蝦,há,used in 虾蟆,"newest-7, new-7",n,5399,1,1-char,这是虾。,This is an used in 虾蟆.
翘,翹,qiáo,outstanding; to raise,"newest-7, new-7, old-6",v,5400,1,1-char,我每天都翘。,I outstanding every day.
消,消,xiāo,to diminish; to subside; to consume; to reduce; to idle away (the time); (after 不 or 只 or 何 etc) to need; to require; to take,"newest-7, new-7",v,5407,1,1-char,我每天都消。,I to diminish; to subside every day.
键,鍵,jiàn,key (on a piano or computer keyboard); button (on a mouse or other device); chemical bond; linchpin,"newest-5, new-5","n, g",5438,1,1-char,这是键。,This is a key.
闲,閑,xián,enclosure; (variant of 闲) idle; unoccupied; leisure,"newest-5, new-5","v, a, ad",5440,1,1-char,我每天都闲。,I enclosure every day.
孔,孔,Kǒng,surname Kong,"newest-7, old-6","n, nr, q",5446,1,1-char,这是孔。,This is a surname Kong.
灌,灌,guàn,to irrigate; to pour; to install (software); to record (music),"newest-7, new-7","v, g",5446,1,1-char,我每天都灌。,I to irrigate every day.
震,震,zhèn,"to shake; to vibrate; to jolt; to quake; excited; shocked; one of the Eight Trigrams 卦, symbolizing thunder; ☳","newest-7, new-7","v, g",5448,1,1-char,我每天都震。,I to shake every day.
谱,譜,pǔ,chart; list; table; register; score (music); spectrum (physics); to set to music,"newest-7, new-7","g, v",5498,1,1-char,我在学习“谱”。,I'm learning '谱'.
驻,駐,zhù,"to halt; to stay; to be stationed (of troops, diplomats etc)","newest-7, new-6",v,5499,1,1-char,我每天都驻。,I to halt every day.
凡,凡,fán,ordinary; commonplace; mundane; temporal; of the material world (as opposed to supernatural or immortal levels); every; all; whatever; altogether; gist; outline; note of Chinese musical scale,new-7,d,5504,1,1-char,他凡来。,He comes ordinary.
景,景,Jǐng,surname Jing,new-6,"g, nr",5509,1,1-char,我在学习“景”。,I'm learning '景'.
鼓,皷,gǔ,old variant of 鼓,"newest-5, new-5","v, n, g, a",5510,1,1-char,我每天都鼓。,I old variant of 鼓 every day.
宰,宰,zǎi,to slaughter; to butcher; to kill (animals etc); (coll.) to fleece; to rip off; to overcharge; (bound form) to govern; to rule; (bound form) (a title for certain government officials in ancient China),"newest-7, new-7, old-6",v,5527,1,1-char,我每天都宰。,I to slaughter; to butcher; to kill every day.
沾,沾,zhān,to moisten; to be infected by; to receive benefit or advantage through a contact; to touch,"newest-7, new-7",v,5557,1,1-char,我每天都沾。,I to moisten every day.
限,限,xiàn,to limit; to restrict; (bound form) limit; bound,"newest-6, new-7","v, g",5564,1,1-char,我每天都限。,I to limit every day.
捞,撈,lāo,to fish up; to dredge up,"newest-7, new-7, old-6",v,5566,1,1-char,我每天都捞。,I to fish up every day.
蠢,惷,chǔn,variant of 蠢; stupid,"newest-7, new-7",a,5576,1,1-char,这个很蠢。,This is very variant of 蠢.
睁,睜,zhēng,to open (one's eyes),"newest-6, new-7, old-5",v,5578,1,1-char,我每天都睁。,I to open every day.
炮,炮,bāo,to sauté; to fry; to dry by heating,"newest-7, new-6","n, q",5592,1,1-char,这是炮。,This is a to sauté.
秋,秋,Qiū,surname Qiu,old-3,"tg, g",5603,1,1-char,我们秋见。,See you surname Qiu.
氧,氧,yǎng,oxygen (chemistry),new-7,n,5633,1,1-char,这是氧。,This is an oxygen.
钩,鈎,gōu,variant of 钩,"newest-7, new-7","n, v",5639,1,1-char,这是钩。,This is a variant of 钩.
盗,盜,dào,to steal; to rob; to plunder; thief; bandit; robber,"newest-7, new-7",g,5640,1,1-char,我在学习“盗”。,I'm learning '盗'.
颇,頗,Pō,surname Po; Taiwan pr. [Pǒ],"newest-7, new-7, old-6",d,5653,1,1-char,他颇来。,He comes surname Po.
钢,鋼,gāng,steel,new-7,n,5658,1,1-char,这是钢。,This is a steel.
溜,溜,liū,to slip away; to escape in stealth; to skate,"newest-7, new-7, old-6","v, q, g",5659,1,1-char,我每天都溜。,I to slip away every day.
拦,攔,lán,to block sb's path; to obstruct; to flag down (a taxi),"newest-6, new-7, old-5","v, vn",5693,1,1-char,我每天都拦。,I to block sb's path every day.
槽,槽,cáo,trough; manger; groove; channel; (Tw) (computing) hard drive,new-7,g,5706,1,1-char,我在学习“槽”。,I'm learning '槽'.
番,番,Pān,surname Pan,"newest-6, new-6, old-6","qv, g",5706,1,1-char,我在学习“番”。,I'm learning '番'.
泪,淚,lèi,tears,"newest-5, new-4",n,5719,1,1-char,这是泪。,This is a tears.
挨,挨,āi,in order; in sequence; close to; adjacent to,"newest-7, new-6, old-6",v,5720,1,1-char,我每天都挨。,I in order; in sequence every day.
汇,匯,huì,to remit; to converge (of rivers); to exchange,"newest-6, new-4","v, g",5752,1,1-char,我每天都汇。,I to remit every day.
训,訓,xùn,to teach; to train; to admonish; instruction (from superiors); teachings; rule,"newest-7, new-7","v, g",5758,1,1-char,我每天都训。,I to teach every day.
赖,賴,Lài,surname Lai; (Tw) (coll.) LINE messaging app,"newest-6, new-6","v, a",5777,1,1-char,我每天都赖。,I surname Lai every day.
奔,奔,bēn,to hurry; to rush; to run quickly; to elope,"newest-7, new-7",v,5778,1,1-char,我每天都奔。,I to hurry every day.
洋,洋,yáng,ocean; vast; foreign; silver dollar or coin,new-6,g,5778,1,1-char,我在学习“洋”。,I'm learning '洋'.
凑,湊,còu,"to gather together, pool or collect; to happen by chance; to move close to; to exploit an opportunity","newest-7, new-7",v,5780,1,1-char,我每天都凑。,"I to gather together, pool or collect every day."
胆,膽,dǎn,"gall bladder; courage; guts; gall; inner container (e.g. bladder of a football, inner container of a thermos)",new-5,n,5783,1,1-char,这是胆。,This is a gall bladder.
截,截,jié,to cut off (a length); to stop; to intercept; section; chunk; length,"newest-7, new-7","v, q",5791,1,1-char,我每天都截。,I to cut off every day.
乡,鄉,xiāng,country or countryside; native place; home village or town; township (PRC administrative unit),"newest-5, new-5",n,5793,1,1-char,这是乡。,This is a country or countryside.
愁,愁,chóu,to worry about,"newest-6, new-5","v, g",5798,1,1-char,我每天都愁。,I to worry about every day.
乃,乃,nǎi,to be; thus; so; therefore; then; only; thereupon,"newest-7, new-7","v, c",5811,1,1-char,我每天都乃。,I to be every day.
撕,撕,sī,to tear,"newest-7, new-7, old-5",v,5814,1,1-char,我每天都撕。,I to tear every day.
舱,艙,cāng,cabin; the hold of a ship or airplane,"newest-7, new-7, old-6",n,5838,1,1-char,这是舱。,This is a cabin.
披,披,pī,to drape over one's shoulders; to open; to unroll; to split open; to spread out,"newest-6, new-5, old-5",v,5845,1,1-char,我每天都披。,I to drape over one's shoulders every day.
严,嚴,Yán,surname Yan,"newest-6, new-4","a, ad, nr",5871,1,1-char,这个很严。,This is very surname Yan.
虚,虛,xū,emptiness; void; abstract theory or guiding principles; empty or unoccupied; diffident or timid; false; humble or modest; (of health) weak; virtual; in vain,"newest-7, new-7","a, d, g",5892,1,1-char,这个很虚。,This is very emptiness.
壳,殼,qiào,shell; carapace; crust (earth's crust etc); also pr. [ké],"newest-7, new-7","g, n",5895,1,1-char,我在学习“壳”。,I'm learning '壳'.
煎,煎,jiān,to pan fry; to sauté,"newest-7, new-7, old-5","v, vn",5908,1,1-char,我每天都煎。,I to pan fry every day.
继,繼,jì,to continue; to follow after; to go on with; to succeed; to inherit; then; afterwards,"newest-7, new-7",g,5916,1,1-char,我在学习“继”。,I'm learning '继'.
删,刪,shān,to delete,"newest-5, new-7",v,5923,1,1-char,我每天都删。,I to delete every day.
矿,礦,kuàng,mineral deposit; ore deposit; ore; a mine,"newest-7, new-6",n,5935,1,1-char,这是矿。,This is a mineral deposit; ore deposit.
邪,衺,xié,old variant of 邪,"newest-7, new-7","a, g, y",5941,1,1-char,这个很邪。,This is very old variant of 邪.
织,織,zhī,to weave,"newest-7, new-6",v,5952,1,1-char,我每天都织。,I to weave every day.
迈,邁,mài,to take a step; to stride,"newest-6, new-7, old-6",v,5964,1,1-char,我每天都迈。,I to take a step every day.
垫,墊,diàn,pad; cushion; mat; to pad out; to fill a gap; to pay for sb; to advance (money),"newest-7, new-7, old-6",v,5968,1,1-char,我每天都垫。,I pad every day.
席,席,Xí,surname Xi,"newest-7, new-7","qt, g",5971,1,1-char,我在学习“席”。,I'm learning '席'.
嫌,嫌,xián,"to dislike; suspicion; resentment; enmity; abbr. for 犯, criminal suspect","newest-6, new-6, old-6","v, g",5973,1,1-char,我每天都嫌。,I to dislike every day.
缩,縮,suō,to withdraw; to pull back; to contract; to shrink; to reduce; abbreviation; also pr. [sù],"newest-7, new-7",v,6001,1,1-char,我每天都缩。,I to withdraw every day.
牢,牢,láo,firm; sturdy; fold (for animals); sacrifice; prison,"newest-6, new-6","a, g",6012,1,1-char,这个很牢。,This is very firm.
盆,盆,pén,"basin; flower pot; unit of volume equal to 12 斗 and 8 升, approx 128 liters","newest-5, new-5, old-5","n, q",6022,1,1-char,这是盆。,This is a basin.
故,故,gù,"happening; instance; reason; cause; intentional; former; old; friend; therefore; hence; (of people) to die, dead","newest-7, new-7","c, g, n",6035,1,1-char,我在学习“故”。,I'm learning '故'.
扬,揚,Yáng,abbr. for 扬州; surname Yang,"newest-7, new-7","g, v",6047,1,1-char,我在学习“扬”。,I'm learning '扬'.
鲜,尟,xiǎn,variant of 鲜,"newest-4, new-4","a, g, ad",6056,1,1-char,这个很鲜。,This is very variant of 鲜.
紫,紫,zǐ,purple; violet,"newest-5, new-5, old-5",a,6061,1,1-char,这个很紫。,This is very purple.
肠,腸,cháng,intestines,"newest-6, new-5",n,6063,1,1-char,这是肠。,This is an intestines.
避,避,bì,to avoid; to shun; to flee; to escape; to keep away from; to leave; to hide from,"newest-6, new-4",v,6063,1,1-char,我每天都避。,I to avoid every day.
壮,壯,Zhuàng,"Zhuang ethnic group of Guangxi, the PRC's second most numerous ethnic group","newest-7, new-7","v, a, b",6069,1,1-char,我每天都壮。,"I Zhuang ethnic group of Guangxi, the PRC's second most numerous ethnic group every day."
辞,辤,cí,old variant of 辞,"newest-7, new-7","v, g",6073,1,1-char,我每天都辞。,I old variant of 辞 every day.
审,審,shěn,to examine; to investigate; carefully; to try (in court),"newest-7, new-7","v, vn",6079,1,1-char,我每天都审。,I to examine every day.
临,臨,lín,to face; to overlook; to arrive; to be (just) about to; just before,"newest-7, new-7","v, g",6091,1,1-char,我每天都临。,I to face every day.
伞,傘,sǎn,umbrella; parasol,"newest-3, new-4, old-3",n,6101,1,1-char,这是伞。,This is an umbrella.
罩,罩,zhào,cover; fish trap (basket); shade,"newest-7, new-7",v,6107,1,1-char,我每天都罩。,I cover every day.
铃,鈴,líng,(small) bell,"newest-5, new-5, old-5","o, g",6132,1,1-char,我在学习“铃”。,I'm learning '铃'.
捧,捧,pěng,to clasp; to cup the hands; to hold up with both hands; to offer (esp. in cupped hands); to praise; to flatter,"newest-6, new-7, old-6","v, q",6144,1,1-char,我每天都捧。,I to clasp every day.
勾,勾,Gōu,surname Gou,"newest-7, new-7",v,6157,1,1-char,我每天都勾。,I surname Gou every day.
渡,渡,dù,to cross; to pass through; to ferry,"newest-6, new-6",v,6175,1,1-char,我每天都渡。,I to cross every day.
癌,癌,ái,cancer; carcinoma; also pr. [yán],"newest-7, new-7",n,6175,1,1-char,这是癌。,This is a cancer.
砖,塼,zhuān,variant of 砖,"newest-6, new-7",n,6186,1,1-char,这是砖。,This is a variant of 砖.
征,征,zhēng,journey; trip; expedition; to go on long campaign; to attack,"newest-7, new-7","v, nr",6191,1,1-char,我每天都征。,I journey every day.
杂,襍,zá,variant of 杂,"newest-6, new-6","a, ad, v",6202,1,1-char,这个很杂。,This is very variant of 杂.
捉,捉,zhuō,to clutch; to grab; to capture,"newest-6, new-6",v,6204,1,1-char,我每天都捉。,I to clutch every day.
瓜,瓜,guā,melon; gourd; squash,new-4,n,6211,1,1-char,这是瓜。,This is a melon.
洒,灑,sǎ,to sprinkle; to spray; to spill; to shed,"newest-5, new-5, old-5",v,6215,1,1-char,我每天都洒。,I to sprinkle every day.
懒,嬾,lǎn,variant of 懒,"newest-4, new-6, old-4",a,6238,1,1-char,这个很懒。,This is very variant of 懒.
捅,捅,tǒng,to stab; to poke; to prod; to nudge; to disclose,"newest-7, new-7",v,6249,1,1-char,我每天都捅。,I to stab every day.
桃,桃,táo,peach,"newest-5, new-5, old-5",n,6265,1,1-char,这是桃。,This is a peach.
胎,胎,tāi,fetus; classifier for litters (of puppies etc); padding (in clothing or bedding); womb carrying a fetus; (fig.) origin; source; (loanword) tire,"newest-7, new-7","g, qv",6282,1,1-char,我在学习“胎”。,I'm learning '胎'.
筒,筒,tǒng,tube; cylinder; to encase in sth cylindrical (such as hands in sleeves etc),"newest-7, new-7","g, q",6284,1,1-char,我在学习“筒”。,I'm learning '筒'.
沟,溝,gōu,ditch; gutter; groove; gully; ravine,"newest-6, new-5",n,6312,1,1-char,这是沟。,This is a ditch.
积,積,jī,to amass; to accumulate; to store; measured quantity (such as area of volume); product (the result of multiplication); to integrate (math.); to solve (or integrate) an ordinary differential equation (math.); old; long-standing,"newest-7, new-7",v,6313,1,1-char,我每天都积。,I to amass every day.
搅,攪,jiǎo,to disturb; to annoy; to mix; to stir,"newest-7, new-7",v,6330,1,1-char,我每天都搅。,I to disturb every day.
赐,賜,cì,to confer; to bestow; to grant; Taiwan pr. [sì],"newest-7, new-7","v, vn",6349,1,1-char,我每天都赐。,I to confer every day.
揍,揍,zòu,to hit; to beat (sb); (coll.) to smash (sth),"newest-7, new-7, old-6","v, vn",6384,1,1-char,我每天都揍。,I to hit; to beat every day.
慌,慌,huāng,to get panicky; to lose one's head; (coll.) (after 得) unbearably; terribly,"newest-7, new-5","a, v",6401,1,1-char,这个很慌。,This is very to get panicky.
猴,猴,hóu,monkey,new-5,g,6437,1,1-char,我在学习“猴”。,I'm learning '猴'.
喘,喘,chuǎn,to gasp; to pant; asthma,"newest-7, new-7",v,6446,1,1-char,我每天都喘。,I to gasp every day.
拽,拽,yè,to drag; to haul,"newest-7, new-7, old-6",v,6459,1,1-char,我每天都拽。,I to drag every day.
墓,墓,mù,grave; tomb; mausoleum,"newest-7, new-6",n,6465,1,1-char,这是墓。,This is a grave.
陷,陷,xiàn,pitfall; trap; to get stuck; to sink; to cave in; to frame (false charge); to capture (a city in battle); to fall (to the enemy); defect,"newest-7, new-7",v,6466,1,1-char,我每天都陷。,I pitfall every day.
束,束,Shù,surname Shu,"newest-5, new-3, old-6","q, v",6473,1,1-char,我在学习“束”。,I'm learning '束'.
抖,抖,dǒu,to tremble; to shake out; to reveal; to make it in the world,"newest-7, new-7",v,6478,1,1-char,我每天都抖。,I to tremble every day.
损,損,sǔn,to decrease; to lose; to damage; to harm; (coll.) to ridicule; to deride; (coll.) caustic; sarcastic; nasty; mean; one of the 64 hexagrams of the Book of Changes: ䷨,new-7,"g, vn",6484,1,1-char,我在学习“损”。,I'm learning '损'.
霜,霜,shuāng,frost; white powder or cream spread over a surface; frosting; (skin) cream,"newest-7, new-7",n,6485,1,1-char,这是霜。,This is a frost.
嫩,嫩,nèn,young and tender; (of food) tender; lightly cooked; (of color) light; (of a person) inexperienced; unskilled,"newest-7, new-7, old-5",a,6514,1,1-char,这个很嫩。,This is very young and tender.
弟,弟,dì,younger brother; junior male; I (modest word in letter),new-1,n,6568,1,1-char,这是弟。,This is a younger brother.
雇,僱,gù,variant of 雇,"newest-7, new-7",v,6583,1,1-char,我每天都雇。,I variant of 雇 every day.
憋,憋,biē,to choke; to stifle; to restrain; to hold back; to hold in (urine); to hold (one's breath),"newest-7, new-7, old-6",v,6662,1,1-char,我每天都憋。,I to choke every day.
摊,攤,tān,to spread out; vendor's stand,"newest-7, new-7","g, n, q, v",6664,1,1-char,我在学习“摊”。,I'm learning '摊'.
轰,轟,hōng,explosion; bang; boom; rumble; to attack; to shoo away; to expel,"newest-7, new-7","v, o",6668,1,1-char,我每天都轰。,I explosion every day.
邀,邀,yāo,to invite; to request; to intercept; to solicit; to seek,"newest-7, new-7","v, vn",6695,1,1-char,我每天都邀。,I to invite every day.
丸,丸,wán,ball; pellet; pill,"newest-7, new-7, old-6",g,6699,1,1-char,我在学习“丸”。,I'm learning '丸'.
抄,抄,chāo,to make a copy; to plagiarize; to search and seize; to raid; to grab; to go off with; to take a shortcut; to make a turning move; to fold one's arms,"newest-6, new-4, old-5",v,6726,1,1-char,我每天都抄。,I to make a copy every day.
兜,兜,dōu,pocket; bag; to wrap up or hold in a bag; to move in a circle; to canvas or solicit; to take responsibility for; to disclose in detail; combat armor (old),"newest-7, new-7, old-6","v, q, n",6727,1,1-char,我每天都兜。,I pocket every day.
棍,棍,gùn,stick; rod; truncheon,"newest-6, new-7",g,6727,1,1-char,我在学习“棍”。,I'm learning '棍'.
扮,扮,bàn,to disguise oneself as; to dress up; to play (a role); to put on (an expression),"newest-7, new-7",v,6738,1,1-char,我每天都扮。,I to disguise oneself as every day.
盼,盼,pàn,to hope for; to long for; to expect,"newest-7, new-7",v,6757,1,1-char,我每天都盼。,I to hope for every day.
评,評,píng,to discuss; to comment; to criticize; to judge; to choose (by public appraisal),"newest-5, new-6",v,6762,1,1-char,我每天都评。,I to discuss every day.
怨,怨,yuàn,to blame; (bound form) resentment; hatred; grudge,"newest-7, new-5","v, vn",6771,1,1-char,我每天都怨。,I to blame every day.
哄,哄,hōng,roar of laughter (onom.); hubbub; to roar (as a crowd),"newest-7, new-7, old-6","v, o",6776,1,1-char,我每天都哄。,I roar of laughter every day.
祭,祭,Zhài,surname Zhai,"newest-7, new-7","v, vn",6789,1,1-char,我每天都祭。,I surname Zhai every day.
炖,燉,dùn,to stew,"newest-7, new-7",v,6833,1,1-char,我每天都炖。,I to stew every day.
券,券,quàn,"bond (esp. document split in two, with each party holding one half); contract; deed (i.e. title deeds); ticket; voucher; certificate","newest-6, new-6",g,6835,1,1-char,我在学习“券”。,I'm learning '券'.
谜,謎,mèi,"see 谜儿, riddle","newest-7, new-7","n, g",6848,1,1-char,这是谜。,"This is a see 谜儿, riddle."
充,充,chōng,sufficient; full; to fill; to serve as; to act as; to act falsely as; to pose as,"newest-7, new-7",v,6849,1,1-char,我每天都充。,I sufficient; full every day.
愈,愈,yù,the more...(the more...); to recover; to heal; better,"newest-7, old-6","d, g",6850,1,1-char,他愈来。,He comes the more....
瞒,瞞,mán,to conceal from; to keep (sb) in the dark,"newest-7, new-7",v,6855,1,1-char,我每天都瞒。,I to conceal from every day.
岸,㟁,àn,variant of 岸,"newest-6, new-5, old-5","n, g",6867,1,1-char,这是岸。,This is a variant of 岸.
润,潤,rùn,"moist; glossy; sleek; to moisten; to lubricate; to embellish; to enhance; profit; remuneration; (neologism c. 2021) (slang) (loanword from ""run"") to emigrate (in order to flee adverse conditions)","newest-7, new-7","v, a, an",6937,1,1-char,我每天都润。,I moist; glossy; sleek every day.
裂,裂,liè,to split; to crack; to break open; to rend,"newest-7, new-6",v,6953,1,1-char,我每天都裂。,I to split every day.
歇,歇,xiē,to rest; to take a break; to stop; to halt; (dialect) to sleep; a moment; a short while,"newest-6, new-5, old-5",v,6962,1,1-char,我每天都歇。,I to rest every day.
粥,粥,yù,used in 荤粥,"newest-6, new-6, old-6",n,6967,1,1-char,这是粥。,This is an used in 荤粥.
账,賬,zhàng,account; bill; debt,new-6,n,6981,1,1-char,这是账。,This is an account.
翼,翼,Yì,surname Yi; alternative name for 绛 capital of the Jin State during the Spring and Autumn Period (770-475 BC),old-6,g,6996,1,1-char,我在学习“翼”。,I'm learning '翼'.
勿,勿,wù,do not,"newest-7, new-7, old-6",d,6999,1,1-char,他勿来。,He comes do not.
盛,盛,Shèng,surname Sheng,"newest-6, new-7, old-6","v, a, ad, g",7003,1,1-char,我每天都盛。,I surname Sheng every day.
蹦,蹦,bèng,to jump; to bounce; to hop,"newest-7, new-7, old-6",v,7023,1,1-char,我每天都蹦。,I to jump every day.
瞪,瞪,dèng,to open (one's eyes) wide; to stare at; to glare at,"newest-7, new-7, old-6",v,7103,1,1-char,我每天都瞪。,I to open  wide every day.
拐,拐,guǎi,to turn (a corner etc); to kidnap; to swindle; to misappropriate; seven (used as a substitute for 七); variant of 拐,"newest-6, new-6","v, g",7146,1,1-char,我每天都拐。,I to turn every day.
泉,泉,quán,spring (small stream); mouth of a spring; coin (archaic),new-5,"g, n, q",7156,1,1-char,我在学习“泉”。,I'm learning '泉'.
栏,欄,lán,fence; railing; hurdle; column or box (of text or other data),"newest-6, new-7",n,7178,1,1-char,这是栏。,This is a fence.
腔,腔,qiāng,(bound form) cavity; tune; accent (in one's speech); (old) (classifier for carcasses of slaughtered livestock),"newest-7, new-7","g, q",7193,1,1-char,我在学习“腔”。,I'm learning '腔'.
傲,傲,ào,proud; arrogant; to despise; unyielding; to defy,"newest-7, new-7","g, a, ad",7205,1,1-char,我在学习“傲”。,I'm learning '傲'.
辩,辯,biàn,to dispute; to debate; to argue; to discuss,"newest-7, new-7",g,7226,1,1-char,我在学习“辩”。,I'm learning '辩'.
裹,裹,guǒ,to wrap around; bundle; parcel; package; to press into service; to pressgang; to make off with (sth),"newest-7, new-7",v,7241,1,1-char,我每天都裹。,I to wrap around every day.
皱,皺,zhòu,to wrinkle; wrinkled; to crease,"newest-7, new-7","v, n",7246,1,1-char,我每天都皱。,I to wrinkle every day.
