hanzi_simplified,hanzi_traditional,pinyin,english_meanings,hsk_levels,pos,frequency_rank,character_count,length_bucket,example_zh,example_en
香,香,xiāng,fragrant; sweet smelling; aromatic; savory or appetizing; (to eat) with relish; (of sleep) sound; perfume or spice; joss or incense stick,"newest-4, new-3, old-4","n, a, v",1953,1,1-char,这是香。,This is a fragrant.
吐,吐,tǔ,"to spit; to send out (silk from a silkworm, bolls from cotton flowers etc); to say; to pour out (one's grievances)","newest-6, new-5, old-5",v,1958,1,1-char,我每天都吐。,I to spit every day.
毒,毒,dú,poison; to poison; poisonous; malicious; cruel; fierce; narcotics,"newest-6, new-5","n, a, v",1958,1,1-char,这是毒。,This is a poison.
州,州,zhōu,prefecture; (old) province; (old) administrative division; state (e.g. of US); oblast (Russia); canton (Switzerland),"newest-6, old-6",n,1970,1,1-char,这是州。,This is a prefecture.
解,解,Xiè,surname Xie,"newest-6, new-6",v,1971,1,1-char,我每天都解。,I surname Xie every day.
贴,貼,tiē,to stick; to paste; to post (e.g. on a blog); to keep close to; to fit snugly; to subsidize; allowance (e.g. money for food or housing); sticker; classifier for sticking plaster: strip,"newest-5, new-4",v,1971,1,1-char,我每天都贴。,I to stick every day.
雪,雪,Xuě,surname Xue,"newest-1, new-2, old-2",n,1971,1,1-char,这是雪。,This is a surname Xue.
罪,罪,zuì,guilt; crime; fault; blame; sin,"newest-6, new-6",n,1978,1,1-char,这是罪。,This is a guilt.
觉,覺,jiào,a nap; a sleep,new-6,"v, g, q",1983,1,1-char,我每天都觉。,I a nap every day.
屋,屋,wū,(bound form) house; (bound form) room,new-5,n,1984,1,1-char,这是屋。,This is a house.
费,費,Fèi,surname Fei,"newest-4, new-3","n, v, nr",1997,1,1-char,这是费。,This is a surname Fei.
灯,燈,dēng,lamp; light; lantern,"newest-3, new-2, old-3",n,2001,1,1-char,这是灯。,This is a lamp.
防,防,fáng,to protect; to defend; to guard against; to prevent,"newest-5, new-3",v,2008,1,1-char,我每天都防。,I to protect every day.
爬,爬,pá,to crawl; to climb; to get up or sit up,"newest-3, new-2",v,2016,1,1-char,我每天都爬。,I to crawl every day.
灵,靈,líng,quick; alert; efficacious; effective; to come true; spirit; departed soul; coffin,"newest-7, new-7","a, g",2026,1,1-char,这个很灵。,This is very quick.
化,化,huā,variant of 花,"newest-5, new-3","v, k, vn",2027,1,1-char,我每天都化。,I variant of 花 every day.
考,攷,kǎo,to beat; to hit; variant of 考; to inspect; to test; to take an exam,"newest-2, new-1","v, g",2030,1,1-char,我每天都考。,I to beat every day.
滴,滴,dī,a drop; to drip,"newest-6, new-6, old-5","v, q",2035,1,1-char,我每天都滴。,I a drop every day.
冰,冰,bīng,ice; to chill sth; (of an object or substance) to feel cold; (of a person) cold; unfriendly; (slang) methamphetamine,"newest-3, new-4",n,2036,1,1-char,这是冰。,This is an ice.
糖,糖,táng,sugar; sweets; candy,"newest-3, new-3, old-3",n,2036,1,1-char,这是糖。,This is a sugar.
砸,砸,zá,to smash; to pound; to fail; to muck up; to bungle,"newest-7, new-7, old-6",v,2037,1,1-char,我每天都砸。,I to smash every day.
许,許,Xǔ,surname Xu,"newest-7, new-7","v, m, g, nr",2038,1,1-char,我每天都许。,I surname Xu every day.
九,九,jiǔ,nine; 9,"newest-1, new-1, old-1","m, t, b",2040,1,1-char,我有三九。,I have three nine.
领,領,lǐng,"neck; collar; to lead; to receive; classifier for clothes, mats, screens etc","newest-5, new-3",v,2044,1,1-char,我每天都领。,I neck every day.
滚,滾,gǔn,to boil; to roll; to take a hike; Get lost!,"newest-5, new-5, old-5",v,2046,1,1-char,我每天都滚。,I to boil every day.
党,黨,Dǎng,surname Dang,"newest-7, new-6, old-6",n,2047,1,1-char,这是党。,This is a surname Dang.
结,結,jiē,(of a plant) to produce (fruit or seeds); Taiwan pr. [jié],"newest-5, new-4","v, n",2051,1,1-char,我每天都结。,I to produce every day.
逃,逃,táo,to escape; to run away; to flee,"newest-6, new-5, old-5","v, vn",2056,1,1-char,我每天都逃。,I to escape every day.
喊,喊,hǎn,to yell; to shout; to call out for (a person),"newest-4, new-2, old-5",v,2060,1,1-char,我每天都喊。,I to yell every day.
撞,撞,zhuàng,to knock against; to bump into; to run into; to meet by accident,"newest-5, new-5, old-4",v,2075,1,1-char,我每天都撞。,I to knock against every day.
印,印,Yìn,surname Yin; abbr. for 度,"newest-6, new-6","v, b, g",2082,1,1-char,我每天都印。,I surname Yin every day.
烦,煩,fán,to feel vexed; to bother; to trouble; superfluous and confusing; edgy,"newest-4, new-4","v, a",2084,1,1-char,我每天都烦。,I to feel vexed every day.
卷,卷,juǎn,"to roll up; roll; classifier for small rolled things (wad of paper money, movie reel etc)","newest-6, new-4, old-5","q, v, g",2089,1,1-char,我在学习“卷”。,I'm learning '卷'.
哎,哎,āi,hey!; (interjection used to attract attention or to express surprise or disapprobation),"newest-5, new-7",e,2092,1,1-char,我在学习“哎”。,I'm learning '哎'.
剧,劇,jù,"theatrical work (play, opera, TV series etc); dramatic (change, increase etc); acute; severe",new-6,"n, g",2094,1,1-char,这是剧。,This is a theatrical work.
透,透,tòu,(bound form) to penetrate; to seep through; to tell secretly; to leak; thoroughly; through and through; to appear; to show,"newest-6, new-4","a, v",2096,1,1-char,这个很透。,This is very to penetrate; to seep through.
治,治,zhì,to rule; to govern; to manage; to control; to harness (a river); to treat (a disease); to wipe out (a pest); to punish; to research,"newest-5, new-4",v,2101,1,1-char,我每天都治。,I to rule every day.
狂,狂,kuáng,mad; wild; violent,"newest-7, new-5","g, a, d",2107,1,1-char,我在学习“狂”。,I'm learning '狂'.
烟,煙,yān,cigarette or pipe tobacco; smoke; mist; vapour; tobacco plant; (of the eyes) to be irritated by smoke,"newest-4, new-3",n,2110,1,1-char,这是烟。,This is a cigarette or pipe tobacco.
酷,酷,kù,ruthless; strong (e.g. of wine); (loanword) cool; hip,"newest-6, new-6","g, d",2111,1,1-char,我在学习“酷”。,I'm learning '酷'.
赶,趕,gǎn,to overtake; to catch up with; to hurry; to rush; to try to catch (the bus etc); to drive (cattle etc) forward; to drive (sb) away; to avail oneself of (an opportunity); until; by (a certain time),"newest-4, new-3",v,2113,1,1-char,我每天都赶。,I to overtake; to catch up with every day.
存,存,cún,to exist; to deposit; to store; to keep; to survive,"newest-4, new-3, old-5",v,2114,1,1-char,我每天都存。,I to exist every day.
桥,橋,qiáo,bridge,"newest-4, new-3, old-4",n,2120,1,1-char,这是桥。,This is a bridge.
迷,迷,mí,to bewilder; crazy about; fan; enthusiast; lost; confused,"newest-5, new-3","v, g",2123,1,1-char,我每天都迷。,I to bewilder every day.
欠,欠,qiàn,to owe; to lack; (literary) to be deficient in; (bound form) yawn; to raise slightly (a part of one's body),"newest-5, new-5, old-5",v,2126,1,1-char,我每天都欠。,I to owe every day.
拖,拕,tuō,variant of 拖,"newest-6, new-6",v,2130,1,1-char,我每天都拖。,I variant of 拖 every day.
娘,娘,niáng,mother; young lady; (coll.) effeminate,"newest-7, new-7",n,2131,1,1-char,这是娘。,This is a mother.
且,且,qiě,and; moreover; yet; for the time being; to be about to; both (... and...),"newest-7, new-7","c, d",2144,1,1-char,我在学习“且”。,I'm learning '且'.
量,量,liáng,to measure,"newest-4, new-4","n, v",2147,1,1-char,这是量。,This is a to measure.
闹,閙,nào,variant of 闹,"newest-5, new-4","v, a",2160,1,1-char,我每天都闹。,I variant of 闹 every day.
塞,塞,Sāi,Serbia; Serbian; abbr. for 塞尔维亚,"newest-6, new-6","v, b, g",2163,1,1-char,我每天都塞。,I Serbia every day.
赚,賺,zhuàn,to earn; to make a profit,"newest-4, new-6, old-4",v,2163,1,1-char,我每天都赚。,I to earn every day.
游,游,Yóu,surname You,"newest-2, new-3","v, g, vn",2164,1,1-char,我每天都游。,I surname You every day.
猜,猜,cāi,to guess,"newest-4, new-5, old-4",v,2168,1,1-char,我每天都猜。,I to guess every day.
盖,蓋,Gě,surname Ge,"newest-5, new-4, old-5","v, g",2188,1,1-char,我每天都盖。,I surname Ge every day.
铁,鐵,Tiě,surname Tie,"newest-7, new-3","n, v",2193,1,1-char,这是铁。,This is a surname Tie.
注,注,zhù,to inject; to pour into; to concentrate; to pay attention; stake (gambling); classifier for sums of money; variant of 注,"newest-7, new-7","v, g",2196,1,1-char,我每天都注。,I to inject every day.
炒,炒,chǎo,to sauté; to stir-fry; to speculate; to hype; to fire (sb),"newest-5, new-6, old-5",v,2197,1,1-char,我每天都炒。,I to sauté every day.
塔,塔,tǎ,pagoda; tower; minaret; stupa (abbr. loanword from Sanskrit tapo),"newest-6, new-6, old-5","n, b",2198,1,1-char,这是塔。,This is a pagoda.
奖,獎,jiǎng,prize; award; encouragement,"newest-4, new-4","n, v",2198,1,1-char,这是奖。,This is a prize.
录,彔,lù,to carve wood,"newest-5, new-3","v, g, vn",2200,1,1-char,我每天都录。,I to carve wood every day.
列,列,liè,to arrange; to line up; file; series; (in data tables) column; (Tw) row,"newest-4, new-4","v, q, n",2209,1,1-char,我每天都列。,I to arrange every day.
搭,搭,dā,"to put up; to build (scaffolding); to hang (clothes on a pole); to connect; to join; to arrange in pairs; to match; to add; to throw in (resources); to take (boat, train); variant of 褡","newest-6, new-6, old-6",v,2220,1,1-char,我每天都搭。,I to put up every day.
洞,洞,dòng,cave; hole; zero (unambiguous spoken form when spelling out numbers),"newest-5, new-5, old-5","n, g",2225,1,1-char,这是洞。,This is a cave.
骑,騎,jì,(Tw) saddle horse; mounted soldier,"newest-3, new-2, old-3",v,2231,1,1-char,我每天都骑。,I saddle horse every day.
响,響,xiǎng,echo; sound; noise; to make a sound; to sound; to ring; loud; classifier for noises,"newest-4, new-2, old-4","v, a, q",2237,1,1-char,我每天都响。,I echo every day.
汤,湯,Tāng,surname Tang,"newest-4, new-3, old-4","n, nr",2237,1,1-char,这是汤。,This is a surname Tang.
贵,貴,guì,expensive; noble; precious; (honorific) your,"newest-1, new-1, old-2","a, r, b, g",2239,1,1-char,这个很贵。,This is very expensive.
签,簽,qiān,to sign one's name; to write brief comments on a document; inscribed bamboo stick (variant of 签); visa,"newest-5, new-5","v, n",2244,1,1-char,我每天都签。,I to sign one's name every day.
制,制,zhì,system; to control; to regulate; variant of 制,"newest-6, new-7","v, k, g",2245,1,1-char,我每天都制。,I system every day.
河,河,hé,river,"newest-3, new-2, old-3",n,2245,1,1-char,这是河。,This is a river.
搬,搬,bān,to move (i.e. relocate oneself); to move (sth relatively heavy or bulky); to shift; to copy indiscriminately,"newest-3, new-3, old-3",v,2254,1,1-char,我每天都搬。,I to move every day.
练,練,liàn,to practice; to train; to drill; to perfect (one's skill); exercise; (literary) white silk; to boil and scour raw silk,"newest-3, new-2",v,2255,1,1-char,我每天都练。,I to practice every day.
价,價,jià,price; value; (chemistry) valence,new-5,n,2258,1,1-char,这是价。,This is a price.
泡,泡,pāo,puffed; swollen; spongy; small lake (esp. in place names); classifier for urine or feces,"newest-6, new-6","v, n, q",2258,1,1-char,我每天都泡。,I puffed; swollen; spongy every day.
爽,爽,shuǎng,bright; clear; crisp; open; frank; straightforward; to feel well; fine; pleasurable; invigorating; to deviate,"newest-7, new-6",g,2263,1,1-char,我在学习“爽”。,I'm learning '爽'.
户,戶,hù,a household; door; family,"newest-6, new-4","g, q",2265,1,1-char,我在学习“户”。,I'm learning '户'.
供,供,gōng,to provide; to supply,"newest-7, new-7",v,2274,1,1-char,我每天都供。,I to provide every day.
凭,凴,píng,variant of 凭,"newest-5, new-5, old-5","p, v",2277,1,1-char,我凭家来。,I come variant of 凭 home.
归,歸,Guī,surname Gui,"newest-6, new-4",v,2278,1,1-char,我每天都归。,I surname Gui every day.
胸,胷,xiōng,variant of 胸,"newest-6, old-5","g, n",2291,1,1-char,我在学习“胸”。,I'm learning '胸'.
探,探,tàn,to explore; to search out; to scout; to visit; to stretch forward,"newest-7, new-7","v, vn",2298,1,1-char,我每天都探。,I to explore every day.
嫁,嫁,jià,(of a woman) to marry; to marry off a daughter; to shift (blame etc),"newest-6, new-7, old-5","v, vn",2300,1,1-char,我每天都嫁。,I to marry every day.
聊,聊,liáo,to chat; to depend upon (literary); temporarily; just; slightly,"newest-3, new-6",v,2302,1,1-char,我每天都聊。,I to chat every day.
脱,脫,tuō,to shed; to take off; to escape; to get away from,"newest-4, new-4, old-4",v,2303,1,1-char,我每天都脱。,I to shed every day.
挑,挑,tiāo,to carry on a shoulder pole; to choose; to pick; to nitpick,"newest-5, new-4",v,2310,1,1-char,我每天都挑。,I to carry on a shoulder pole every day.
举,擧,jǔ,variant of 举,"newest-4, new-2, old-5","v, g",2311,1,1-char,我每天都举。,I variant of 举 every day.
碎,碎,suì,(transitive or intransitive verb) to break into pieces; to shatter; to crumble; broken; fragmentary; scattered; garrulous,"newest-5, new-5, old-5","a, v",2313,1,1-char,这个很碎。,This is very to break into pieces; to shatter; to crumble.
厂,厂,hǎn,"""cliff"" radical in Chinese characters (Kangxi radical 27), occurring in 原, 历, 压 etc","newest-4, new-3",n,2329,1,1-char,这是厂。,"This is a ""cliff"" radical in Chinese characters , occurring in 原, 历, 压 etc."
踢,踢,tī,to kick; to play (e.g. soccer); (slang) butch (in a lesbian relationship),"newest-2, new-6, old-2",v,2330,1,1-char,我每天都踢。,I to kick every day.
苦,苦,kǔ,bitter; hardship; pain; to suffer; to bring suffering to; painstakingly,"newest-4, new-4, old-4","a, an, ad, v",2331,1,1-char,这个很苦。,This is very bitter.
租,租,zū,to hire; to rent; to charter; to rent out; to lease out; rent; land tax,"newest-4, new-2, old-4","v, g",2332,1,1-char,我每天都租。,I to hire every day.
吸,吸,xī,to breathe; to suck in; to absorb; to inhale,"newest-4, new-4",v,2340,1,1-char,我每天都吸。,I to breathe every day.
箱,箱,xiāng,box; trunk; chest,new-4,"g, q",2345,1,1-char,我在学习“箱”。,I'm learning '箱'.
母,母,mǔ,mother; elderly female relative; origin; source; (of animals) female,"newest-6, new-6","b, g",2351,1,1-char,我在学习“母”。,I'm learning '母'.
角,角,Jué,surname Jue,"newest-3, new-2, old-3","n, q, g",2370,1,1-char,这是角。,This is a surname Jue.
躲,躲,duǒ,to hide; to dodge; to avoid,"newest-5, new-5",v,2378,1,1-char,我每天都躲。,I to hide every day.
冒,冐,mào,old variant of 冒,"newest-6, new-5",v,2381,1,1-char,我每天都冒。,I old variant of 冒 every day.
烂,爛,làn,soft; mushy; well-cooked and soft; to rot; to decompose; rotten; worn out; chaotic; messy; utterly; thoroughly; crappy; bad,"newest-6, new-5, old-5","a, v",2387,1,1-char,这个很烂。,This is very soft; mushy.
胖,胖,pán,healthy; at ease,"newest-3, new-3, old-3",a,2396,1,1-char,这个很胖。,This is very healthy.
批,批,pī,"to ascertain; to act on; to criticize; to pass on; classifier for batches, lots, military flights; tier (for the ranking of universities and colleges)","newest-5, new-4, old-5","q, v",2398,1,1-char,我在学习“批”。,I'm learning '批'.
除,除,chú,to get rid of; to remove; to exclude; to eliminate; to wipe out; to divide; except; not including,"newest-6, new-6, old-5","p, v",2398,1,1-char,我除家来。,I come to get rid of home.
土,土,Tǔ,Tu (ethnic group); surname Tu,"newest-4, new-3","n, b, a",2399,1,1-char,这是土。,This is a Tu.
醉,醉,zuì,intoxicated,"newest-5, new-5, old-5","v, vn",2402,1,1-char,我每天都醉。,I intoxicated every day.
负,負,fù,to bear; to carry (on one's back); to turn one's back on; to be defeated; negative (math. etc),"newest-7, new-6","v, b, m",2403,1,1-char,我每天都负。,I to bear every day.
页,頁,xié,head,"newest-3, new-1, old-4","q, g",2404,1,1-char,我在学习“页”。,I'm learning '页'.
扔,扔,rēng,to throw; to throw away,"newest-4, new-5, old-4",v,2405,1,1-char,我每天都扔。,I to throw every day.
念,唸,niàn,"variant of 念, to read aloud","newest-5, new-3, old-5","v, g",2410,1,1-char,我每天都念。,"I variant of 念, to read aloud every day."
端,端,duān,end; extremity; item; port; to hold sth level with both hands; to carry; regular,"newest-6, new-6, old-6","v, q, g",2412,1,1-char,我每天都端。,I end every day.
礼,禮,Lǐ,"surname Li; abbr. for 礼记, Classic of Rites",new-5,"n, g",2414,1,1-char,这是礼。,This is a surname Li.
扣,扣,kòu,"to fasten; to button; button; buckle; knot; to arrest; to confiscate; to deduct (money); discount; to knock; to smash, spike or dunk (a ball); to cover (with a bowl etc); (fig.) to tag a label on sb; (Tw) (loanword) code","newest-6, new-6","v, g",2421,1,1-char,我每天都扣。,I to fasten every day.
狼,狼,láng,wolf,"newest-6, new-7, old-5",n,2421,1,1-char,这是狼。,This is a wolf.
闻,聞,Wén,surname Wen,"newest-4, new-2, old-5",v,2427,1,1-char,我每天都闻。,I surname Wen every day.
村,村,cūn,village,"newest-4, new-3",n,2435,1,1-char,这是村。,This is a village.
缺,缺,quē,deficiency; lack; scarce; vacant post; to run short of,"newest-4, new-3",v,2448,1,1-char,我每天都缺。,I deficiency every day.
挖,挖,wā,to dig; to excavate; to scoop out,"newest-6, new-6",v,2449,1,1-char,我每天都挖。,I to dig every day.
剩,剩,shèng,to remain; to be left; to have as remainder,"newest-4, new-5, old-4",v,2453,1,1-char,我每天都剩。,I to remain every day.
百,百,Bǎi,surname Bai,"newest-1, new-1, old-2","m, t",2455,1,1-char,我有三百。,I have three surname Bai.
拼,拼,pīn,to piece together; to join together; to stake all; adventurous; at the risk of one's life; to spell,"newest-5, new-5","v, vn",2461,1,1-char,我每天都拼。,I to piece together every day.
盯,盯,dīng,to watch attentively; to fix one's attention on; to stare at; to gaze at,"newest-7, new-7, old-6",v,2464,1,1-char,我每天都盯。,I to watch attentively every day.
草,艸,cǎo,variant of 草,"newest-3, new-2, old-3",n,2467,1,1-char,这是草。,This is a variant of 草.
湖,湖,hú,lake,"newest-5, new-2","n, b",2468,1,1-char,这是湖。,This is a lake.
兵,兵,bīng,soldiers; a force; an army; weapons; arms; military; warlike,"newest-6, new-4",n,2469,1,1-char,这是兵。,This is a soldiers.
院,院,yuàn,courtyard; institution,new-2,"n, g",2470,1,1-char,这是院。,This is a courtyard.
甜,甜,tián,sweet,"newest-3, new-3, old-3",a,2472,1,1-char,这个很甜。,This is very sweet.
硬,硬,yìng,hard; stiff; solid; (fig.) strong; firm; resolutely; uncompromisingly; laboriously; with great difficulty; good (quality); able (person); (of food) filling; substantial,"newest-5, new-5, old-4","a, d",2476,1,1-char,这个很硬。,This is very hard; stiff; solid.
侧,側,cè,the side; to incline towards; to lean; inclined; lateral; side,"newest-6, new-6","v, g, f, q",2493,1,1-char,我每天都侧。,I the side every day.
妹,妹,mèi,younger sister,new-1,n,2496,1,1-char,这是妹。,This is a younger sister.
闭,閉,bì,to close; to stop up; to shut; to obstruct,"newest-6, new-6",v,2503,1,1-char,我每天都闭。,I to close every day.
牙,牙,yá,tooth; ivory,"newest-3, new-4",n,2506,1,1-char,这是牙。,This is a tooth.
粉,粉,fěn,powder; cosmetic face powder; food prepared from starch; noodles or pasta made from any kind of flour; to turn to powder; (dialect) to whitewash; white; pink; (suffix) fan (abbr. for 粉丝); to be a fan of,"newest-6, new-7","n, g, b, a",2506,1,1-char,这是粉。,This is a powder.
足,足,jù,excessive,"newest-6, new-6","a, d, g",2507,1,1-char,这个很足。,This is very excessive.
曲,曲,Qū,surname Qu,"newest-6, new-7","g, n, q, v",2509,1,1-char,我在学习“曲”。,I'm learning '曲'.
唉,唉,āi,"interjection or grunt of agreement or recognition (e.g. yes, it's me!); to sigh","newest-5, new-7, old-5",e,2512,1,1-char,我在学习“唉”。,I'm learning '唉'.
设,設,shè,to set up; to put in place; (math.) given; suppose; if,"newest-7, new-7",v,2512,1,1-char,我每天都设。,I to set up; to put in place every day.
公,公,gōng,"public; collectively owned; common; international (e.g. high seas, metric system, calendar); make public; fair; just; Duke, highest of five orders of nobility 位; honorable (gentlemen); father-in-law; male (animal)","newest-6, new-6","g, b",2520,1,1-char,我在学习“公”。,I'm learning '公'.
弹,彈,dàn,crossball; bullet; shot; shell; ball,"newest-4, new-5, old-4","v, g, vn",2520,1,1-char,我每天都弹。,I crossball every day.
必,必,bì,certainly; must; will; necessarily,"newest-5, new-5",d,2532,1,1-char,他必来。,He comes certainly.
托,托,tuō,prop; support (for weight); rest (e.g. arm rest); thanks to; to hold in one's hand; to support in one's palm; to give; to base; to commit; to set; torr (unit of pressure),"newest-7, new-6","v, g",2533,1,1-char,我每天都托。,I prop every day.
拨,撥,bō,"to push aside with the hand, foot, a stick etc; to dial; to allocate; to set aside (money); to poke (the fire); to pluck (a string instrument); to turn round; classifier: group, batch","newest-7, new-7","v, q",2539,1,1-char,我每天都拨。,"I to push aside with the hand, foot, a stick etc every day."
艘,艘,sōu,classifier for ships; Taiwan pr. [sāo],"newest-6, new-7, old-6",q,2548,1,1-char,我在学习“艘”。,I'm learning '艘'.
古,古,Gǔ,surname Gu,"newest-5, new-3","a, tg",2558,1,1-char,这个很古。,This is very surname Gu.
杆,杆,gān,pole,"newest-7, new-6","g, q",2562,1,1-char,我在学习“杆”。,I'm learning '杆'.
咬,咬,yǎo,to bite; to nip,"newest-5, new-5, old-5",v,2563,1,1-char,我每天都咬。,I to bite every day.
银,銀,yín,silver; silver-colored; relating to money or currency,"newest-6, new-3, old-5","b, g, n",2564,1,1-char,我在学习“银”。,I'm learning '银'.
刺,刺,cī,(onom.) whoosh,"newest-6, new-4, old-6","v, n",2566,1,1-char,我每天都刺。,I whoosh every day.
羊,羊,Yáng,surname Yang,"newest-3, new-3",n,2574,1,1-char,这是羊。,This is a surname Yang.
肥,肥,féi,fat; fertile; loose-fitting or large; to fertilize; to become rich by illegal means; fertilizer; manure,"newest-6, new-4","n, a, v",2580,1,1-char,这是肥。,This is a fat.
患,患,huàn,to suffer (from illness); to contract (a disease); misfortune; trouble; danger; worry,"newest-6, new-7","v, g",2581,1,1-char,我每天都患。,I to suffer every day.
湿,溼,shī,variant of 湿,"newest-5, new-4","a, v",2585,1,1-char,这个很湿。,This is very variant of 湿.
枚,枚,Méi,surname Mei,"newest-7, new-7, old-6",q,2591,1,1-char,我在学习“枚”。,I'm learning '枚'.
暗,晻,àn,variant of 暗,"newest-5, new-4, old-4","a, ad",2594,1,1-char,这个很暗。,This is very variant of 暗.
诗,詩,Shī,"abbr. for Shijing 诗经, the Book of Songs","newest-5, new-4, old-5",n,2594,1,1-char,这是诗。,"This is an abbr. for Shijing 诗经, the Book of Songs."
瘦,瘦,shòu,thin; to lose weight; (of clothing) tight; (of meat) lean; (of land) unproductive,"newest-3, new-5, old-3",a,2595,1,1-char,这个很瘦。,This is very thin.
绝,絕,jué,to cut short; extinct; to disappear; to vanish; absolutely; by no means,"newest-7, new-6","d, g",2597,1,1-char,他绝来。,He comes to cut short.
勒,勒,lè,"to rein in; to compel; to force; to carve; to engrave; (literary) to command; to lead; bridle; (physics) abbr. for 斯, lux","newest-7, new-7",v,2605,1,1-char,我每天都勒。,I to rein in every day.
锁,鎖,suǒ,to lock; to lock up; a lock,"newest-5, new-5, old-5","v, n",2607,1,1-char,我每天都锁。,I to lock; to lock up every day.
绿,綠,lǜ,green; (slang) (derived from 绿帽子) to cheat on (one's spouse or boyfriend or girlfriend),"new-2, old-3","a, an",2608,1,1-char,这个很绿。,This is very green.
造,造,zào,to make; to build; to manufacture; to invent; to fabricate; to go to; party (in a lawsuit or legal agreement); crop; classifier for crops,"newest-5, new-3",v,2608,1,1-char,我每天都造。,I to make every day.
害,害,hài,to do harm to; to cause trouble to; harm; evil; calamity,"newest-6, new-5","v, n, g",2616,1,1-char,我每天都害。,I to do harm to every day.
素,素,sù,"raw silk; white; plain, unadorned; vegetarian (food); essence; nature; element; constituent; usually; always; ever","newest-7, new-7","g, n, a",2618,1,1-char,我在学习“素”。,I'm learning '素'.
立,立,Lì,surname Li,"newest-6, new-5",v,2622,1,1-char,我每天都立。,I surname Li every day.
骂,罵,mà,to scold; to abuse; to curse,"newest-5, new-5, old-5",v,2622,1,1-char,我每天都骂。,I to scold every day.
料,料,liào,material; stuff; grain; feed; to expect; to anticipate; to guess,"newest-6, new-6","n, v",2626,1,1-char,这是料。,This is a material.
稍,稍,shāo,somewhat; a little,"newest-4, new-5",d,2631,1,1-char,他稍来。,He comes somewhat.
守,守,shǒu,to guard; to defend; to keep watch; to abide by the law; to observe (rules or ritual); nearby; adjoining,"newest-5, new-4",v,2638,1,1-char,我每天都守。,I to guard every day.
滑,滑,Huá,surname Hua,"newest-5, new-5","v, a",2639,1,1-char,我每天都滑。,I surname Hua every day.
撒,撒,sā,to let go; to cast; to let loose; to discharge; to give expression to; (coll.) to pee,"newest-6, new-7",v,2662,1,1-char,我每天都撒。,I to let go every day.
嗨,嗨,hāi,oh alas; hey!; hi! (loanword); a high (natural or drug-induced) (loanword),old-6,e,2664,1,1-char,我在学习“嗨”。,I'm learning '嗨'.
